{
    "url": "https://www.vlerick.com/en/programmes/programmes-in-innovation-management/transforming-to-sustainable-business/",
    "title": "TRANSFORMING TO SUSTAINABLE BUSINESS",
    "subtitle": "",
    "key_facts": {
        "fee": "€5,495 (excl. 21% VAT)",
        "format": "4 days",
        "location": "Brussels",
        "start_date": "Starts 28 April 2026"
    },
    "description": "Creating a more sustainable business has never been more important to the planet. But how do you learn to set priorities, make sustainability transformation a reality – and reap the new opportunities it brings? Find answers on how to transform your organisation and deal with global ESG challenges in this programme.\n\nIt’s designed to support your transformation journey, so you can leap into building smart, sustainable business models that will benefit both your organisation and society.",
    "sections": [
        {
            "heading": "EMBED ESG IN YOUR ORGANISATION AND DEVELOP SUSTAINABILITY-DRIVEN BUSINESS OPPORTUNITIES",
            "content": "TRANSFORMING TO SUSTAINABLE BUSINESS\nEMBED ESG IN YOUR ORGANISATION AND DEVELOP SUSTAINABILITY-DRIVEN BUSINESS OPPORTUNITIES"
        },
        {
            "heading": "#1",
            "content": "#1"
        },
        {
            "heading": "57",
            "content": "57"
        },
        {
            "heading": "4.2/5",
            "content": "4.2/5"
        },
        {
            "heading": "DETAILED PROGRAMME",
            "content": "DETAILED PROGRAMME"
        },
        {
            "heading": "UPCOMING EDITION",
            "content": "UPCOMING EDITION\nFINANCING YOUR PROGRAMME\n28 April-11 June 2026\n4 days\nBrussels\n€5,495 (excl. 21% VAT)\nEnglish\nSCHEDULE\nREGISTER"
        },
        {
            "heading": "WHY THIS PROGRAMME",
            "content": "WHY THIS PROGRAMME"
        },
        {
            "heading": "WHO SHOULD ATTEND",
            "content": "WHO SHOULD ATTEND"
        },
        {
            "heading": "FEES AND FINANCING",
            "content": "FEES AND FINANCING"
        },
        {
            "heading": "SUCCESS STORIES",
            "content": "SUCCESS STORIES\nDAVID BLAZQUEZ VILA\n\nHead of Business Strategy and Project Management at an international financial institution\n\nVlerick’s Transforming to Sustainable Business programme not only deepened my understanding of sustainability but it also gave me principles and practices for cultivating a sustainable mindset. Grounded in real-world examples and best practices, the content is not just theoretical but highly relevant and immediately actionable.\n\nLAURA JONCKHEERE\n\nSustainability Manager Dossche Mills\n\nThe most challenging aspect of my job as a Sustainability Manager is that sustainability is still being shaped by changing stakeholder expectations, new legislation, etc. This programme gave me numerous networking opportunities and direct feedback, new insights, and inspiration on our sustainability strategy."
        },
        {
            "heading": "DAVID BLAZQUEZ VILA",
            "content": "DAVID BLAZQUEZ VILA\n\nHead of Business Strategy and Project Management at an international financial institution"
        },
        {
            "heading": "LAURA JONCKHEERE",
            "content": "LAURA JONCKHEERE\n\nSustainability Manager Dossche Mills"
        },
        {
            "heading": "FACULTY",
            "content": "FACULTY"
        },
        {
            "heading": "Xavier Baeten",
            "content": "Xavier Baeten\n\nProfessor of Reward & Sustainability"
        },
        {
            "heading": "Koen Tackx",
            "content": "Koen Tackx\n\nProfessor of Marketing"
        },
        {
            "heading": "Walter Van Dyck",
            "content": "Walter Van Dyck\n\nProfessor of Innovation Management"
        },
        {
            "heading": "Jean Vanhoegaerden",
            "content": "Jean Vanhoegaerden\n\nAdjunct Professor of Change Management"
        },
        {
            "heading": "Smaranda Boroş",
            "content": "Smaranda Boroş\n\nProfessor of Organisational Behaviour"
        },
        {
            "heading": "Kerstin Fehre",
            "content": "Kerstin Fehre\n\nProfessor of Strategy"
        },
        {
            "heading": "Karlien Vanderheyden",
            "content": "Karlien Vanderheyden\n\nProfessor of Organisational Behaviour"
        },
        {
            "heading": "GET IN TOUCH!",
            "content": "GET IN TOUCH!\nLinh Pham\n\nProduct Manager\n\nLINH.PHAM@VLERICK.COM\n+32 2 225 41 55\nBOOK AN APPOINTMENT"
        },
        {
            "heading": "Linh Pham",
            "content": "Linh Pham\n\nProduct Manager\n\nLINH.PHAM@VLERICK.COM\n+32 2 225 41 55\nBOOK AN APPOINTMENT"
        },
        {
            "heading": "RELATED PROGRAMMES",
            "content": "RELATED PROGRAMMES\nEssentials in Sustainability Management\n\nSustainability\n\nProfessional\n\nUpcoming editions:\n\nStarts anytime\nAdd to comparison\nBROCHURE\nMORE INFO"
        },
        {
            "heading": "Essentials in Sustainability Management",
            "content": "Essentials in Sustainability Management\n\nSustainability"
        },
        {
            "heading": "RELATED INSIGHTS",
            "content": "RELATED INSIGHTS\nMORE INSIGHTS\nBanking on Impact: A Sustainable Future Pays Dividends\nInterview series ‘CEO Perspectives in Banking’ – part 2: Sustainability\nFINANCIAL SERVICES MANAGEMENT, SUSTAINABILITY\n30 JUNE 2025\nBJORN CUMPS\nREAD INSIGHT\nThe Great Values Matching is coming to your pension fund\nACCOUNTING & FINANCE, SUSTAINABILITY\n20 JUNE 2025\nTHANOS VEROUSIS\nREAD INSIGHT"
        },
        {
            "heading": "Banking on Impact: A Sustainable Future Pays Dividends",
            "content": "Banking on Impact: A Sustainable Future Pays Dividends"
        },
        {
            "heading": "The Great Values Matching is coming to your pension fund",
            "content": "The Great Values Matching is coming to your pension fund"
        }
    ],
    "foldable_sections": [
        "DETAILED PROGRAMME\n\nThis four-day interactive programme includes 3 days of on-campus learning, three expert webinars – and a final coaching session where you’ll hone your sustainability transformation plan.\n\nModule 1: Where is your organisation today?\n\nWhat do we mean by sustainable value creation?\nAssess your current level of sustainability and learn to set priorities\nDiscover how to develop a materiality and impact assessment\nExplore how to engage stakeholders\nLearn about stakeholder preferences, stakeholder dialogue and stakeholder engagement\n\nModule 2: Where do you want your organisation to be?\n\nDevelop and implement a clear sustainability strategy\nDiscover how circularity can create new opportunities\nExplore the opportunities sustainable pricing models can offer\nGain a clear view on how you can innovate your business model for sustainability\n\nModule 3: How to get there?\n\nDefine your organisation’s ecosystem and its role in the transformation process\nDiscover the need for regulations to make changes in the whole eco-system of a certain industry\nLearn how to implement change for positive impact\n\nModule 4: Sustainability webinars\n\nGo more in-depth with these expert webinars that each touch upon a specific sustainability-related topic: \n\nHow to create a sustainability mindset in your company\nSustainability marketing: understand customer barriers and how to overcome them\nExplore the role of diversity, equity and inclusion (DEI)\n\nModule 5: Project coaching \n\nAnalyse your organisation’s sustainability priorities and develop your transformation plan\nLearn from business experts, our experienced faculty and your peers",
        "DETAILED PROGRAMME\n\nThis four-day interactive programme includes 3 days of on-campus learning, three expert webinars – and a final coaching session where you’ll hone your sustainability transformation plan.\n\nModule 1: Where is your organisation today?\n\nWhat do we mean by sustainable value creation?\nAssess your current level of sustainability and learn to set priorities\nDiscover how to develop a materiality and impact assessment\nExplore how to engage stakeholders\nLearn about stakeholder preferences, stakeholder dialogue and stakeholder engagement\n\nModule 2: Where do you want your organisation to be?\n\nDevelop and implement a clear sustainability strategy\nDiscover how circularity can create new opportunities\nExplore the opportunities sustainable pricing models can offer\nGain a clear view on how you can innovate your business model for sustainability\n\nModule 3: How to get there?\n\nDefine your organisation’s ecosystem and its role in the transformation process\nDiscover the need for regulations to make changes in the whole eco-system of a certain industry\nLearn how to implement change for positive impact\n\nModule 4: Sustainability webinars\n\nGo more in-depth with these expert webinars that each touch upon a specific sustainability-related topic: \n\nHow to create a sustainability mindset in your company\nSustainability marketing: understand customer barriers and how to overcome them\nExplore the role of diversity, equity and inclusion (DEI)\n\nModule 5: Project coaching \n\nAnalyse your organisation’s sustainability priorities and develop your transformation plan\nLearn from business experts, our experienced faculty and your peers",
        "DETAILED PROGRAMME",
        "This four-day interactive programme includes 3 days of on-campus learning, three expert webinars – and a final coaching session where you’ll hone your sustainability transformation plan.\n\nModule 1: Where is your organisation today?\n\nWhat do we mean by sustainable value creation?\nAssess your current level of sustainability and learn to set priorities\nDiscover how to develop a materiality and impact assessment\nExplore how to engage stakeholders\nLearn about stakeholder preferences, stakeholder dialogue and stakeholder engagement\n\nModule 2: Where do you want your organisation to be?\n\nDevelop and implement a clear sustainability strategy\nDiscover how circularity can create new opportunities\nExplore the opportunities sustainable pricing models can offer\nGain a clear view on how you can innovate your business model for sustainability\n\nModule 3: How to get there?\n\nDefine your organisation’s ecosystem and its role in the transformation process\nDiscover the need for regulations to make changes in the whole eco-system of a certain industry\nLearn how to implement change for positive impact\n\nModule 4: Sustainability webinars\n\nGo more in-depth with these expert webinars that each touch upon a specific sustainability-related topic: \n\nHow to create a sustainability mindset in your company\nSustainability marketing: understand customer barriers and how to overcome them\nExplore the role of diversity, equity and inclusion (DEI)\n\nModule 5: Project coaching \n\nAnalyse your organisation’s sustainability priorities and develop your transformation plan\nLearn from business experts, our experienced faculty and your peers",
        "WHY THIS PROGRAMME\nAcquire essential frameworks, models and tools to implement sustainability in your organisation’s strategy\nExplore core sustainability topics – including sustainability maturity, materiality, target-setting, diversity and circularity\nDevelop a sustainability mindset – for yourself and your organisation\nLeverage your strategy and marketing skills to make the world more sustainable\nLearn to build alliances to make positive change happen\nBuild an action plan for your sustainability project",
        "WHY THIS PROGRAMME\nAcquire essential frameworks, models and tools to implement sustainability in your organisation’s strategy\nExplore core sustainability topics – including sustainability maturity, materiality, target-setting, diversity and circularity\nDevelop a sustainability mindset – for yourself and your organisation\nLeverage your strategy and marketing skills to make the world more sustainable\nLearn to build alliances to make positive change happen\nBuild an action plan for your sustainability project",
        "WHY THIS PROGRAMME",
        "Acquire essential frameworks, models and tools to implement sustainability in your organisation’s strategy\nExplore core sustainability topics – including sustainability maturity, materiality, target-setting, diversity and circularity\nDevelop a sustainability mindset – for yourself and your organisation\nLeverage your strategy and marketing skills to make the world more sustainable\nLearn to build alliances to make positive change happen\nBuild an action plan for your sustainability project",
        "WHO SHOULD ATTEND\nManagers or leaders who play a crucial role in their organisation’s sustainability journey\nSustainability managers who are new to the role and need the tools to develop a sustainability strategy and roadmap\nProfessionals who want to raise awareness of sustainability in their organisations",
        "WHO SHOULD ATTEND\nManagers or leaders who play a crucial role in their organisation’s sustainability journey\nSustainability managers who are new to the role and need the tools to develop a sustainability strategy and roadmap\nProfessionals who want to raise awareness of sustainability in their organisations",
        "WHO SHOULD ATTEND",
        "Managers or leaders who play a crucial role in their organisation’s sustainability journey\nSustainability managers who are new to the role and need the tools to develop a sustainability strategy and roadmap\nProfessionals who want to raise awareness of sustainability in their organisations",
        "FEES AND FINANCING\n\nBoost your impact – and your budget\nDid you know you may be eligible for:\n\nGroup discount: Register three participants from the same company at the same time and get 15% off\nKMO-portefeuille: Flemish SMEs can apply for funding to cover training costs\nAlumni discount: Vlerick alumni receive 10% off as a thank you for their loyalty to the Vlerick Business School\n\nCheck all our benefits and make the most of your investment.",
        "FEES AND FINANCING\n\nBoost your impact – and your budget\nDid you know you may be eligible for:\n\nGroup discount: Register three participants from the same company at the same time and get 15% off\nKMO-portefeuille: Flemish SMEs can apply for funding to cover training costs\nAlumni discount: Vlerick alumni receive 10% off as a thank you for their loyalty to the Vlerick Business School\n\nCheck all our benefits and make the most of your investment.",
        "FEES AND FINANCING",
        "Boost your impact – and your budget\nDid you know you may be eligible for:\n\nGroup discount: Register three participants from the same company at the same time and get 15% off\nKMO-portefeuille: Flemish SMEs can apply for funding to cover training costs\nAlumni discount: Vlerick alumni receive 10% off as a thank you for their loyalty to the Vlerick Business School\n\nCheck all our benefits and make the most of your investment.",
        "FACULTY\nXavier Baeten\n\nProfessor of Reward & Sustainability\n\nXavier Baeten is highlighting the vital role of rewarding in helping organisations deliver their strategy and gain competitive advantage.\n\nKoen Tackx\n\nProfessor of Marketing\n\nKoen Tackx creates sustainable value for customers, shareholders and society with effective pricing, innovation and product management.\n\nWalter Van Dyck\n\nProfessor of Innovation Management\n\nWalter Van Dyck supports global science and technology companies with strategic innovation management.\n\nJean Vanhoegaerden\n\nAdjunct Professor of Change Management\n\nJean Vanhoegaerden has over 25 years of experience teaching executive education programmes across the world.\n\nSmaranda Boroş\n\nProfessor of Organisational Behaviour\n\nIf you want to change the world, Smaranda Boros is here to guide, challenge and support you. \n\nKerstin Fehre\n\nProfessor of Strategy\n\nKerstin Fehre is passionate about strategy and explores the ways organisations make strategic decisions.\n\nKarlien Vanderheyden\n\nProfessor of Organisational Behaviour\n\nKarlien Vanderheyden focuses on how individuals can impact an organisation’s people, processes and performance.",
        "FACULTY\nXavier Baeten\n\nProfessor of Reward & Sustainability\n\nXavier Baeten is highlighting the vital role of rewarding in helping organisations deliver their strategy and gain competitive advantage.\n\nKoen Tackx\n\nProfessor of Marketing\n\nKoen Tackx creates sustainable value for customers, shareholders and society with effective pricing, innovation and product management.\n\nWalter Van Dyck\n\nProfessor of Innovation Management\n\nWalter Van Dyck supports global science and technology companies with strategic innovation management.\n\nJean Vanhoegaerden\n\nAdjunct Professor of Change Management\n\nJean Vanhoegaerden has over 25 years of experience teaching executive education programmes across the world.\n\nSmaranda Boroş\n\nProfessor of Organisational Behaviour\n\nIf you want to change the world, Smaranda Boros is here to guide, challenge and support you. \n\nKerstin Fehre\n\nProfessor of Strategy\n\nKerstin Fehre is passionate about strategy and explores the ways organisations make strategic decisions.\n\nKarlien Vanderheyden\n\nProfessor of Organisational Behaviour\n\nKarlien Vanderheyden focuses on how individuals can impact an organisation’s people, processes and performance.",
        "Xavier Baeten\n\nProfessor of Reward & Sustainability\n\nXavier Baeten is highlighting the vital role of rewarding in helping organisations deliver their strategy and gain competitive advantage.\n\nKoen Tackx\n\nProfessor of Marketing\n\nKoen Tackx creates sustainable value for customers, shareholders and society with effective pricing, innovation and product management.\n\nWalter Van Dyck\n\nProfessor of Innovation Management\n\nWalter Van Dyck supports global science and technology companies with strategic innovation management.\n\nJean Vanhoegaerden\n\nAdjunct Professor of Change Management\n\nJean Vanhoegaerden has over 25 years of experience teaching executive education programmes across the world.\n\nSmaranda Boroş\n\nProfessor of Organisational Behaviour\n\nIf you want to change the world, Smaranda Boros is here to guide, challenge and support you. \n\nKerstin Fehre\n\nProfessor of Strategy\n\nKerstin Fehre is passionate about strategy and explores the ways organisations make strategic decisions.\n\nKarlien Vanderheyden\n\nProfessor of Organisational Behaviour\n\nKarlien Vanderheyden focuses on how individuals can impact an organisation’s people, processes and performance."
    ],
    "testimonials": [],
    "contact": {},
    "full_text": "#1\n\nin Open Executive Education in Belgium and #25 worldwide\n\n57\n\nformer participants\n\n4.2/5\n\nfor Learning Impact\n\nCreating a more sustainable business has never been more important to the planet. But how do you learn to set priorities, make sustainability transformation a reality – and reap the new opportunities it brings? Find answers on how to transform your organisation and deal with global ESG challenges in this programme.\n\nIt’s designed to support your transformation journey, so you can leap into building smart, sustainable business models that will benefit both your organisation and society.\n\n<\nDetailed programmeWhy this programmeWho should attendFees and financingFaculty\nBROCHURE\nREGISTER\nDETAILED PROGRAMME\n\nThis four-day interactive programme includes 3 days of on-campus learning, three expert webinars – and a final coaching session where you’ll hone your sustainability transformation plan.\n\nModule 1: Where is your organisation today?\n\nWhat do we mean by sustainable value creation?\nAssess your current level of sustainability and learn to set priorities\nDiscover how to develop a materiality and impact assessment\nExplore how to engage stakeholders\nLearn about stakeholder preferences, stakeholder dialogue and stakeholder engagement\n\nModule 2: Where do you want your organisation to be?\n\nDevelop and implement a clear sustainability strategy\nDiscover how circularity can create new opportunities\nExplore the opportunities sustainable pricing models can offer\nGain a clear view on how you can innovate your business model for sustainability\n\nModule 3: How to get there?\n\nDefine your organisation’s ecosystem and its role in the transformation process\nDiscover the need for regulations to make changes in the whole eco-system of a certain industry\nLearn how to implement change for positive impact\n\nModule 4: Sustainability webinars\n\nGo more in-depth with these expert webinars that each touch upon a specific sustainability-related topic: \n\nHow to create a sustainability mindset in your company\nSustainability marketing: understand customer barriers and how to overcome them\nExplore the role of diversity, equity and inclusion (DEI)\n\nModule 5: Project coaching \n\nAnalyse your organisation’s sustainability priorities and develop your transformation plan\nLearn from business experts, our experienced faculty and your peers\nUPCOMING EDITION\nFINANCING YOUR PROGRAMME\n28 April-11 June 2026\n4 days\nBrussels\n€5,495 (excl. 21% VAT)\nEnglish\nSCHEDULE\nREGISTER\nWHY THIS PROGRAMME\nAcquire essential frameworks, models and tools to implement sustainability in your organisation’s strategy\nExplore core sustainability topics – including sustainability maturity, materiality, target-setting, diversity and circularity\nDevelop a sustainability mindset – for yourself and your organisation\nLeverage your strategy and marketing skills to make the world more sustainable\nLearn to build alliances to make positive change happen\nBuild an action plan for your sustainability project\nWHO SHOULD ATTEND\nManagers or leaders who play a crucial role in their organisation’s sustainability journey\nSustainability managers who are new to the role and need the tools to develop a sustainability strategy and roadmap\nProfessionals who want to raise awareness of sustainability in their organisations\nFEES AND FINANCING\n\nBoost your impact – and your budget\nDid you know you may be eligible for:\n\nGroup discount: Register three participants from the same company at the same time and get 15% off\nKMO-portefeuille: Flemish SMEs can apply for funding to cover training costs\nAlumni discount: Vlerick alumni receive 10% off as a thank you for their loyalty to the Vlerick Business School\n\nCheck all our benefits and make the most of your investment.\n\nSUCCESS STORIES\nDAVID BLAZQUEZ VILA\n\nHead of Business Strategy and Project Management at an international financial institution\n\nVlerick’s Transforming to Sustainable Business programme not only deepened my understanding of sustainability but it also gave me principles and practices for cultivating a sustainable mindset. Grounded in real-world examples and best practices, the content is not just theoretical but highly relevant and immediately actionable.\n\nLAURA JONCKHEERE\n\nSustainability Manager Dossche Mills\n\nThe most challenging aspect of my job as a Sustainability Manager is that sustainability is still being shaped by changing stakeholder expectations, new legislation, etc. This programme gave me numerous networking opportunities and direct feedback, new insights, and inspiration on our sustainability strategy.\n\nFACULTY\nXavier Baeten\n\nProfessor of Reward & Sustainability\n\nXavier Baeten is highlighting the vital role of rewarding in helping organisations deliver their strategy and gain competitive advantage.\n\nKoen Tackx\n\nProfessor of Marketing\n\nKoen Tackx creates sustainable value for customers, shareholders and society with effective pricing, innovation and product management.\n\nWalter Van Dyck\n\nProfessor of Innovation Management\n\nWalter Van Dyck supports global science and technology companies with strategic innovation management.\n\nJean Vanhoegaerden\n\nAdjunct Professor of Change Management\n\nJean Vanhoegaerden has over 25 years of experience teaching executive education programmes across the world.\n\nSmaranda Boroş\n\nProfessor of Organisational Behaviour\n\nIf you want to change the world, Smaranda Boros is here to guide, challenge and support you. \n\nKerstin Fehre\n\nProfessor of Strategy\n\nKerstin Fehre is passionate about strategy and explores the ways organisations make strategic decisions.\n\nKarlien Vanderheyden\n\nProfessor of Organisational Behaviour\n\nKarlien Vanderheyden focuses on how individuals can impact an organisation’s people, processes and performance.\n\nGET IN TOUCH!\nLinh Pham\n\nProduct Manager\n\nLINH.PHAM@VLERICK.COM\n+32 2 225 41 55\nBOOK AN APPOINTMENT"
}