{
    "url": "https://www.vlerick.com/en/programmes/programmes-in-marketing-sales/essentials-in-change-management/",
    "title": "ESSENTIALS IN CHANGE MANAGEMENT",
    "subtitle": "",
    "key_facts": {
        "fee": "€695 (excl. 21% VAT)",
        "format": "10-12 hours",
        "location": "Online",
        "start_date": "Starts anytime"
    },
    "description": "In our fast-paced world, organisations face continual disruption – and teams need to be agile enough to take care of today’s business while planning for tomorrow’s ever-changing demands.  \n\nBut how do you go about tackling change? And what roles can you play? This 100% online, self-paced programme explores these questions, and gives you the tools to leap into supporting – or even leading – organisational change.",
    "sections": [
        {
            "heading": "CONTRIBUTE EFFECTIVELY TO YOUR ORGANISATION'S CHANGE INITIATIVES",
            "content": "ESSENTIALS IN CHANGE MANAGEMENT\nCONTRIBUTE EFFECTIVELY TO YOUR ORGANISATION'S CHANGE INITIATIVES"
        },
        {
            "heading": "#1",
            "content": "#1"
        },
        {
            "heading": "183",
            "content": "183"
        },
        {
            "heading": "4.4/5",
            "content": "4.4/5"
        },
        {
            "heading": "DETAILED PROGRAMME",
            "content": "DETAILED PROGRAMME"
        },
        {
            "heading": "UPCOMING EDITION",
            "content": "UPCOMING EDITION\nFINANCING YOUR PROGRAMME\nStarts anytime\n10-12 hours\nOnline\n€695 (excl. 21% VAT)\nEnglish\nREGISTER"
        },
        {
            "heading": "WHY THIS PROGRAMME",
            "content": "WHY THIS PROGRAMME"
        },
        {
            "heading": "WHO SHOULD ATTEND",
            "content": "WHO SHOULD ATTEND"
        },
        {
            "heading": "FEES AND FINANCING",
            "content": "FEES AND FINANCING"
        },
        {
            "heading": "FACULTY",
            "content": "FACULTY"
        },
        {
            "heading": "David Patient",
            "content": "David Patient\n\nProfessor of Leadership"
        },
        {
            "heading": "GET IN TOUCH!",
            "content": "GET IN TOUCH!\nLinh Pham\n\nProduct Manager\n\nLINH.PHAM@VLERICK.COM\n+32 2 225 41 55\nBOOK AN APPOINTMENT"
        },
        {
            "heading": "Linh Pham",
            "content": "Linh Pham\n\nProduct Manager\n\nLINH.PHAM@VLERICK.COM\n+32 2 225 41 55\nBOOK AN APPOINTMENT"
        },
        {
            "heading": "RELATED PROGRAMMES",
            "content": "RELATED PROGRAMMES\nLeadership Transition Programme\n\nPeople Management & Leadership\n\nProfessional\n\nUpcoming editions:\n\n16 Mar 2026 - Dutch - Ghent\n5 Oct 2026 - English - Brussels\n22 Oct 2026 - Dutch - Ghent\nAdd to comparison\nBROCHURE\nMORE INFO\nLeading Digital Transformation\n\nDigital Transformation and AI / People Management & Leadership\n\nProfessional\n\nUpcoming editions:\n\n20 Aug 2026 - English - Brussels\nAdd to comparison\nBROCHURE\nMORE INFO"
        },
        {
            "heading": "Leadership Transition Programme",
            "content": "Leadership Transition Programme\n\nPeople Management & Leadership"
        },
        {
            "heading": "Leading Digital Transformation",
            "content": "Leading Digital Transformation\n\nDigital Transformation and AI / People Management & Leadership"
        },
        {
            "heading": "RELATED ARTICLES",
            "content": "RELATED ARTICLES\nMORE INSIGHTS\nWomen reach top executive roles 2.5 years earlier than men on average – but leave much sooner\nPEOPLE MANAGEMENT & LEADERSHIP\n07 JANUARY 2026\nESHA MENDIRATTA\nREAD INSIGHT\nCompanies must do more to challenge the silencing culture around microaggressions\nPEOPLE MANAGEMENT & LEADERSHIP\n05 DECEMBER 2025\nSMARANDA BOROŞ\nDELIA MENSITIERI\nREAD INSIGHT"
        },
        {
            "heading": "Women reach top executive roles 2.5 years earlier than men on average – but leave much sooner",
            "content": "Women reach top executive roles 2.5 years earlier than men on average – but leave much sooner"
        },
        {
            "heading": "Companies must do more to challenge the silencing culture around microaggressions",
            "content": "Companies must do more to challenge the silencing culture around microaggressions"
        }
    ],
    "foldable_sections": [
        "DETAILED PROGRAMME\n\nThis programme is divided into eight modules. Each one takes you deeper into the Six Batteries change model – from understanding to applying it in your own organisation.\n\nModule 1: Introduction to change\n\nExplore the history of change management and various approaches\nGet to know the Kotter model, Lewin model and ADKAR approach\n\nModule 2: Your role within change\n\nThink about how change works at your place of work and what role you might play within change\n\nModule 3: Six Batteries of Change\n\nDiscover why change is a dynamic process\nDive into the Six Batteries of Change model\nUnderstand how it applies to your organisation \n\nModule 4: The rational batteries\n\nExplore the rational batteries in detail \n\nModule 5: The emotional batteries\n\nExplore the rational batteries in details\n\nModule 6: Applying the Six Batteries model\n\nDive into a practical case\n\nModule 7: Implementing the framework\n\nReflect on your role in your organisation\n\nModule 8: Conclusion\n\nEvaluate what you've learned during the programme\nCreate a plan for how you'll use your new knowledge to contribute to your organisation\n\nThis online learning journey includes videos, exercises, quizzes, case studies and real-life examples to keep you engaged and motivated. You’ll also have background reading and questions to consider to help you apply what you learn to your own experience.\n\nAnd you’ll have the opportunity to put theory into practice – and become more confident about making strategic choices regarding change.\n\nYou can start Essentials in Change Management anytime – and study wherever and whenever suits you. It takes around 10 to 12 hours to complete the programme, over a maximum of three months.",
        "DETAILED PROGRAMME\n\nThis programme is divided into eight modules. Each one takes you deeper into the Six Batteries change model – from understanding to applying it in your own organisation.\n\nModule 1: Introduction to change\n\nExplore the history of change management and various approaches\nGet to know the Kotter model, Lewin model and ADKAR approach\n\nModule 2: Your role within change\n\nThink about how change works at your place of work and what role you might play within change\n\nModule 3: Six Batteries of Change\n\nDiscover why change is a dynamic process\nDive into the Six Batteries of Change model\nUnderstand how it applies to your organisation \n\nModule 4: The rational batteries\n\nExplore the rational batteries in detail \n\nModule 5: The emotional batteries\n\nExplore the rational batteries in details\n\nModule 6: Applying the Six Batteries model\n\nDive into a practical case\n\nModule 7: Implementing the framework\n\nReflect on your role in your organisation\n\nModule 8: Conclusion\n\nEvaluate what you've learned during the programme\nCreate a plan for how you'll use your new knowledge to contribute to your organisation\n\nThis online learning journey includes videos, exercises, quizzes, case studies and real-life examples to keep you engaged and motivated. You’ll also have background reading and questions to consider to help you apply what you learn to your own experience.\n\nAnd you’ll have the opportunity to put theory into practice – and become more confident about making strategic choices regarding change.\n\nYou can start Essentials in Change Management anytime – and study wherever and whenever suits you. It takes around 10 to 12 hours to complete the programme, over a maximum of three months.",
        "DETAILED PROGRAMME",
        "This programme is divided into eight modules. Each one takes you deeper into the Six Batteries change model – from understanding to applying it in your own organisation.\n\nModule 1: Introduction to change\n\nExplore the history of change management and various approaches\nGet to know the Kotter model, Lewin model and ADKAR approach\n\nModule 2: Your role within change\n\nThink about how change works at your place of work and what role you might play within change\n\nModule 3: Six Batteries of Change\n\nDiscover why change is a dynamic process\nDive into the Six Batteries of Change model\nUnderstand how it applies to your organisation \n\nModule 4: The rational batteries\n\nExplore the rational batteries in detail \n\nModule 5: The emotional batteries\n\nExplore the rational batteries in details\n\nModule 6: Applying the Six Batteries model\n\nDive into a practical case\n\nModule 7: Implementing the framework\n\nReflect on your role in your organisation\n\nModule 8: Conclusion\n\nEvaluate what you've learned during the programme\nCreate a plan for how you'll use your new knowledge to contribute to your organisation\n\nThis online learning journey includes videos, exercises, quizzes, case studies and real-life examples to keep you engaged and motivated. You’ll also have background reading and questions to consider to help you apply what you learn to your own experience.\n\nAnd you’ll have the opportunity to put theory into practice – and become more confident about making strategic choices regarding change.\n\nYou can start Essentials in Change Management anytime – and study wherever and whenever suits you. It takes around 10 to 12 hours to complete the programme, over a maximum of three months.",
        "WHY THIS PROGRAMME\n\nIf you’re working in a fast-changing environment and looking for practical tools and approaches to deal with disruption, then this programme is for you. You’ll learn why managing change can be challenging – and discover how you can contribute to change at every level of an organisation. And you’ll gain the knowledge and insights to positively influence and participate in change initiatives.",
        "WHY THIS PROGRAMME\n\nIf you’re working in a fast-changing environment and looking for practical tools and approaches to deal with disruption, then this programme is for you. You’ll learn why managing change can be challenging – and discover how you can contribute to change at every level of an organisation. And you’ll gain the knowledge and insights to positively influence and participate in change initiatives.",
        "WHY THIS PROGRAMME",
        "If you’re working in a fast-changing environment and looking for practical tools and approaches to deal with disruption, then this programme is for you. You’ll learn why managing change can be challenging – and discover how you can contribute to change at every level of an organisation. And you’ll gain the knowledge and insights to positively influence and participate in change initiatives.",
        "WHO SHOULD ATTEND\nProfessionals who work in turbulent environments where change is ongoing\nPeople managers who need to energise their team to achieve successful change\nProfessionals leading change projects or implementing a change project are invited to join the programme 'Change Management'",
        "WHO SHOULD ATTEND\nProfessionals who work in turbulent environments where change is ongoing\nPeople managers who need to energise their team to achieve successful change\nProfessionals leading change projects or implementing a change project are invited to join the programme 'Change Management'",
        "WHO SHOULD ATTEND",
        "Professionals who work in turbulent environments where change is ongoing\nPeople managers who need to energise their team to achieve successful change\nProfessionals leading change projects or implementing a change project are invited to join the programme 'Change Management'",
        "FEES AND FINANCING\n\nBoost your impact – and your budget\nDid you know you may be eligible for:\n\nGroup discount: Register three participants from the same company at the same time and get 15% off\nAlumni discount: Vlerick alumni receive 10% off as a thank you for their loyalty to the Vlerick Business School\n\nCheck all our benefits and make the most of your investment.",
        "FEES AND FINANCING\n\nBoost your impact – and your budget\nDid you know you may be eligible for:\n\nGroup discount: Register three participants from the same company at the same time and get 15% off\nAlumni discount: Vlerick alumni receive 10% off as a thank you for their loyalty to the Vlerick Business School\n\nCheck all our benefits and make the most of your investment.",
        "FEES AND FINANCING",
        "Boost your impact – and your budget\nDid you know you may be eligible for:\n\nGroup discount: Register three participants from the same company at the same time and get 15% off\nAlumni discount: Vlerick alumni receive 10% off as a thank you for their loyalty to the Vlerick Business School\n\nCheck all our benefits and make the most of your investment.",
        "FACULTY\nDavid Patient\n\nProfessor of Leadership\n\nDavid Patient explores the effects of managerial communication, power and influence.",
        "FACULTY\nDavid Patient\n\nProfessor of Leadership\n\nDavid Patient explores the effects of managerial communication, power and influence.",
        "David Patient\n\nProfessor of Leadership\n\nDavid Patient explores the effects of managerial communication, power and influence."
    ],
    "testimonials": [],
    "contact": {},
    "full_text": "#1\n\nin Open Executive Education in Belgium and #24 worldwide\n\n183\n\nformer participants\n\n4.4/5\n\nfor Learning Impact\n\nIn our fast-paced world, organisations face continual disruption – and teams need to be agile enough to take care of today’s business while planning for tomorrow’s ever-changing demands.  \n\nBut how do you go about tackling change? And what roles can you play? This 100% online, self-paced programme explores these questions, and gives you the tools to leap into supporting – or even leading – organisational change.\n\n<\nDetailed programmeWhy this programmeWho should attendFees and financingFaculty\nBROCHURE\nREGISTER\nDETAILED PROGRAMME\n\nThis programme is divided into eight modules. Each one takes you deeper into the Six Batteries change model – from understanding to applying it in your own organisation.\n\nModule 1: Introduction to change\n\nExplore the history of change management and various approaches\nGet to know the Kotter model, Lewin model and ADKAR approach\n\nModule 2: Your role within change\n\nThink about how change works at your place of work and what role you might play within change\n\nModule 3: Six Batteries of Change\n\nDiscover why change is a dynamic process\nDive into the Six Batteries of Change model\nUnderstand how it applies to your organisation \n\nModule 4: The rational batteries\n\nExplore the rational batteries in detail \n\nModule 5: The emotional batteries\n\nExplore the rational batteries in details\n\nModule 6: Applying the Six Batteries model\n\nDive into a practical case\n\nModule 7: Implementing the framework\n\nReflect on your role in your organisation\n\nModule 8: Conclusion\n\nEvaluate what you've learned during the programme\nCreate a plan for how you'll use your new knowledge to contribute to your organisation\n\nThis online learning journey includes videos, exercises, quizzes, case studies and real-life examples to keep you engaged and motivated. You’ll also have background reading and questions to consider to help you apply what you learn to your own experience.\n\nAnd you’ll have the opportunity to put theory into practice – and become more confident about making strategic choices regarding change.\n\nYou can start Essentials in Change Management anytime – and study wherever and whenever suits you. It takes around 10 to 12 hours to complete the programme, over a maximum of three months.\n\nUPCOMING EDITION\nFINANCING YOUR PROGRAMME\nStarts anytime\n10-12 hours\nOnline\n€695 (excl. 21% VAT)\nEnglish\nREGISTER\nWHY THIS PROGRAMME\n\nIf you’re working in a fast-changing environment and looking for practical tools and approaches to deal with disruption, then this programme is for you. You’ll learn why managing change can be challenging – and discover how you can contribute to change at every level of an organisation. And you’ll gain the knowledge and insights to positively influence and participate in change initiatives.  \n\nWHO SHOULD ATTEND\nProfessionals who work in turbulent environments where change is ongoing\nPeople managers who need to energise their team to achieve successful change\nProfessionals leading change projects or implementing a change project are invited to join the programme 'Change Management'\nFEES AND FINANCING\n\nBoost your impact – and your budget\nDid you know you may be eligible for:\n\nGroup discount: Register three participants from the same company at the same time and get 15% off\nAlumni discount: Vlerick alumni receive 10% off as a thank you for their loyalty to the Vlerick Business School\n\nCheck all our benefits and make the most of your investment.\n\nFACULTY\nDavid Patient\n\nProfessor of Leadership\n\nDavid Patient explores the effects of managerial communication, power and influence.\n\nGET IN TOUCH!\nLinh Pham\n\nProduct Manager\n\nLINH.PHAM@VLERICK.COM\n+32 2 225 41 55\nBOOK AN APPOINTMENT"
}