{
    "url": "https://www.vlerick.com/en/programmes/programmes-in-general-management/executive-development-programme/",
    "title": "EXECUTIVE DEVELOPMENT PROGRAMME",
    "subtitle": "",
    "key_facts": {
        "fee": "€20,195 (excl. 21% VAT)",
        "format": "21 days",
        "location": "Brussels, Ghent, Leuven",
        "start_date": "Starts 19 May 2026"
    },
    "description": "Over the course of one year, this programme prepares experienced managers to become more effective and confident business leaders in their organisations.\n\nIt’s a unique opportunity to sharpen your leadership skills, develop a holistic approach to management and deepen your strategic insights.",
    "sections": [
        {
            "heading": "ELEVATE YOUR CROSS-FUNCTIONAL THINKING AND PERSONAL EFFECTIVENESS",
            "content": "EXECUTIVE DEVELOPMENT PROGRAMME\nELEVATE YOUR CROSS-FUNCTIONAL THINKING AND PERSONAL EFFECTIVENESS"
        },
        {
            "heading": "#1",
            "content": "#1"
        },
        {
            "heading": "3,509",
            "content": "3,509"
        },
        {
            "heading": "4.6/5",
            "content": "4.6/5"
        },
        {
            "heading": "DETAILED PROGRAMME",
            "content": "DETAILED PROGRAMME"
        },
        {
            "heading": "UPCOMING EDITIONS",
            "content": "UPCOMING EDITIONS\nFINANCING YOUR PROGRAMME\nStarts 19 May 2026\n21 days\nBrussels, Ghent, Leuven\n€20,195 (excl. 21% VAT)\nDutch\nSCHEDULE\nAPPLY\nStarts 28 October 2026\n18 days\nBrussels, Ghent, Leuven\n€17,995 (excl. 21% VAT)\nEnglish\nSCHEDULE\nAPPLY"
        },
        {
            "heading": "WHY THIS PROGRAMME",
            "content": "WHY THIS PROGRAMME"
        },
        {
            "heading": "WHO SHOULD ATTEND",
            "content": "WHO SHOULD ATTEND"
        },
        {
            "heading": "PRACTICAL INFO",
            "content": "PRACTICAL INFO"
        },
        {
            "heading": "FEES AND FINANCING",
            "content": "FEES AND FINANCING"
        },
        {
            "heading": "SUCCESS STORIES",
            "content": "SUCCESS STORIES\nCINDY WILLEMS\n\nLeading Lady at Fierce Management\n\nVlerick’s Executive Development Programme provided the academic foundation I needed to advance my career. The inspiring professors and practical insights transformed my approach to business. Within 10 months, the investment paid off. It was a life-changing experience, and I’d return in a heartbeat for an MBA!\n\nTINNEKE DENAYER\n\nRare Blood Disorder Leader at Sanofi Genzyme\n\nEvery module delivered new business insights and enhanced motivation to make things happen. Our group was diverse, with people from different sectors of industry and government, as well as entrepreneurs. A dynamic and tight group of great people − and even now we are still in contact. This programme was a building block for the rest of my career."
        },
        {
            "heading": "CINDY WILLEMS",
            "content": "CINDY WILLEMS\n\nLeading Lady at Fierce Management"
        },
        {
            "heading": "TINNEKE DENAYER",
            "content": "TINNEKE DENAYER\n\nRare Blood Disorder Leader at Sanofi Genzyme"
        },
        {
            "heading": "FACULTY",
            "content": "FACULTY"
        },
        {
            "heading": "Kurt Verweire",
            "content": "Kurt Verweire\n\nProfessor of Strategy"
        },
        {
            "heading": "Steve Muylle",
            "content": "Steve Muylle\n\nProfessor of Digital Strategy and Marketing"
        },
        {
            "heading": "Wouter De Maeseneire",
            "content": "Wouter De Maeseneire\n\nProfessor of Corporate Finance"
        },
        {
            "heading": "Katleen De Stobbeleir",
            "content": "Katleen De Stobbeleir\n\nProfessor of Leadership"
        },
        {
            "heading": "Koen Tackx",
            "content": "Koen Tackx\n\nProfessor of Marketing"
        },
        {
            "heading": "Carine Peeters",
            "content": "Carine Peeters\n\nProfessor of Strategy"
        },
        {
            "heading": "Bram Doolaege",
            "content": "Bram Doolaege\n\nFounding Partner at Streetwize"
        },
        {
            "heading": "Frank Caron",
            "content": "Frank Caron\n\nGeneral Director at Management Today International"
        },
        {
            "heading": "GET IN TOUCH!",
            "content": "GET IN TOUCH!\nRian De Bruycker\n\nCustomer Relationship Manager\n\nRIAN.DEBRUYCKER@VLERICK.COM\n+32 9 210 92 99\nBOOK AN APPOINTMENT"
        },
        {
            "heading": "Rian De Bruycker",
            "content": "Rian De Bruycker\n\nCustomer Relationship Manager\n\nRIAN.DEBRUYCKER@VLERICK.COM\n+32 9 210 92 99\nBOOK AN APPOINTMENT"
        },
        {
            "heading": "RELATED PROGRAMMES",
            "content": "RELATED PROGRAMMES\nAdvanced Management Programme\n\nStrategy / General Management\n\nProfessional\n\nUpcoming editions:\n\n20 Nov 2026 - Dutch - Brussels, Ghent\nAdd to comparison\nBROCHURE\nMORE INFO\nLeadership Transition Programme\n\nPeople Management & Leadership\n\nProfessional\n\nUpcoming editions:\n\n16 Mar 2026 - Dutch - Ghent\n5 Oct 2026 - English - Brussels\n22 Oct 2026 - Dutch - Ghent\nAdd to comparison\nBROCHURE\nMORE INFO"
        },
        {
            "heading": "Advanced Management Programme",
            "content": "Advanced Management Programme\n\nStrategy / General Management"
        },
        {
            "heading": "Leadership Transition Programme",
            "content": "Leadership Transition Programme\n\nPeople Management & Leadership"
        },
        {
            "heading": "RELATED ARTICLES",
            "content": "RELATED ARTICLES\nMORE INSIGHTS\nWomen reach top executive roles 2.5 years earlier than men on average – but leave much sooner\nPEOPLE MANAGEMENT & LEADERSHIP\n07 JANUARY 2026\nESHA MENDIRATTA\nREAD INSIGHT\nCompanies must do more to challenge the silencing culture around microaggressions\nPEOPLE MANAGEMENT & LEADERSHIP\n05 DECEMBER 2025\nSMARANDA BOROŞ\nDELIA MENSITIERI\nREAD INSIGHT"
        },
        {
            "heading": "Women reach top executive roles 2.5 years earlier than men on average – but leave much sooner",
            "content": "Women reach top executive roles 2.5 years earlier than men on average – but leave much sooner"
        },
        {
            "heading": "Companies must do more to challenge the silencing culture around microaggressions",
            "content": "Companies must do more to challenge the silencing culture around microaggressions"
        }
    ],
    "foldable_sections": [
        "DETAILED PROGRAMME\n\nThe programme will give you insights, tools and frameworks that will empower you to become a more effective and knowledgeable business leader. Throughout the programme, you can immediately apply your learnings in an in-company project - creating immediate value for you and your organisation.  \n\nYou can tailor your learning trajectory by selecting one or more electives (maximum 7 days): either you opt to dive deep into a topic from the core programme or you choose a new one. We gladly assist you in making the right choice.  \n\nWinning with strategy\n\nLearn strategic concepts and how to apply them\nDevelop your strategic thinking and reflect on your organisation’s strategic choices\nDiscover how to respond to competitive marketplaces with strategic innovation\n\n(Self-)leadership \n\nExplore the dynamics of leadership, teamwork and culture – and reflect on your role in building a high-performance team \nDiscover your leadership style through a 360° feedback tool , and create a personal development plan \nLearn how to use your full potential\n\nBusiness mastery\n\nLearn in depth about finance, digital innovation and change management\nDiscover the potential of cross-functional thinking – and how to increase your impact on your organisation \nPut your knowledge and team spirit into action during a business simulation  \n\nElectives\n\nPersonalise your learning journey by selecting up to seven days from our short-term programmes : either dive into a new topic or deepen (one of) the topics of the core programme. Depending on the topic(s) you choose, you can do your electives before, during or after the core programme. You have two years to complete your programme.\n\nIn-company project \n\nApply your new learnings to an in-company project – responding to a business or strategic challenge for your own organisation.\n\nApply your learning to a project from your own organisation\nUse your fellow participants and our expert faculty as a sounding board\nCreate ROI for your organisation",
        "DETAILED PROGRAMME\n\nThe programme will give you insights, tools and frameworks that will empower you to become a more effective and knowledgeable business leader. Throughout the programme, you can immediately apply your learnings in an in-company project - creating immediate value for you and your organisation.  \n\nYou can tailor your learning trajectory by selecting one or more electives (maximum 7 days): either you opt to dive deep into a topic from the core programme or you choose a new one. We gladly assist you in making the right choice.  \n\nWinning with strategy\n\nLearn strategic concepts and how to apply them\nDevelop your strategic thinking and reflect on your organisation’s strategic choices\nDiscover how to respond to competitive marketplaces with strategic innovation\n\n(Self-)leadership \n\nExplore the dynamics of leadership, teamwork and culture – and reflect on your role in building a high-performance team \nDiscover your leadership style through a 360° feedback tool , and create a personal development plan \nLearn how to use your full potential\n\nBusiness mastery\n\nLearn in depth about finance, digital innovation and change management\nDiscover the potential of cross-functional thinking – and how to increase your impact on your organisation \nPut your knowledge and team spirit into action during a business simulation  \n\nElectives\n\nPersonalise your learning journey by selecting up to seven days from our short-term programmes : either dive into a new topic or deepen (one of) the topics of the core programme. Depending on the topic(s) you choose, you can do your electives before, during or after the core programme. You have two years to complete your programme.\n\nIn-company project \n\nApply your new learnings to an in-company project – responding to a business or strategic challenge for your own organisation.\n\nApply your learning to a project from your own organisation\nUse your fellow participants and our expert faculty as a sounding board\nCreate ROI for your organisation",
        "DETAILED PROGRAMME",
        "The programme will give you insights, tools and frameworks that will empower you to become a more effective and knowledgeable business leader. Throughout the programme, you can immediately apply your learnings in an in-company project - creating immediate value for you and your organisation.  \n\nYou can tailor your learning trajectory by selecting one or more electives (maximum 7 days): either you opt to dive deep into a topic from the core programme or you choose a new one. We gladly assist you in making the right choice.  \n\nWinning with strategy\n\nLearn strategic concepts and how to apply them\nDevelop your strategic thinking and reflect on your organisation’s strategic choices\nDiscover how to respond to competitive marketplaces with strategic innovation\n\n(Self-)leadership \n\nExplore the dynamics of leadership, teamwork and culture – and reflect on your role in building a high-performance team \nDiscover your leadership style through a 360° feedback tool , and create a personal development plan \nLearn how to use your full potential\n\nBusiness mastery\n\nLearn in depth about finance, digital innovation and change management\nDiscover the potential of cross-functional thinking – and how to increase your impact on your organisation \nPut your knowledge and team spirit into action during a business simulation  \n\nElectives\n\nPersonalise your learning journey by selecting up to seven days from our short-term programmes : either dive into a new topic or deepen (one of) the topics of the core programme. Depending on the topic(s) you choose, you can do your electives before, during or after the core programme. You have two years to complete your programme.\n\nIn-company project \n\nApply your new learnings to an in-company project – responding to a business or strategic challenge for your own organisation.\n\nApply your learning to a project from your own organisation\nUse your fellow participants and our expert faculty as a sounding board\nCreate ROI for your organisation",
        "WHY THIS PROGRAMME\nMake a bigger impact in your organisation \nStrengthen your leadership capabilities and business acumen \nLearn to align cross-functional management domains \nAfter graduating from this programme, you are entitled to join our alumni network. Visit the Vlerick Alumni website for more information",
        "WHY THIS PROGRAMME\nMake a bigger impact in your organisation \nStrengthen your leadership capabilities and business acumen \nLearn to align cross-functional management domains \nAfter graduating from this programme, you are entitled to join our alumni network. Visit the Vlerick Alumni website for more information",
        "WHY THIS PROGRAMME",
        "Make a bigger impact in your organisation \nStrengthen your leadership capabilities and business acumen \nLearn to align cross-functional management domains \nAfter graduating from this programme, you are entitled to join our alumni network. Visit the Vlerick Alumni website for more information",
        "WHO SHOULD ATTEND\nExperienced managers (at least 10 years of working experience and 4 years in a management role) who:\naspire a more senior management role \nare looking to understand key linkages across disciplines\nseek to maximize their leadership potential\nwant to develop their strategic leadership capabilities",
        "WHO SHOULD ATTEND\nExperienced managers (at least 10 years of working experience and 4 years in a management role) who:\naspire a more senior management role \nare looking to understand key linkages across disciplines\nseek to maximize their leadership potential\nwant to develop their strategic leadership capabilities",
        "WHO SHOULD ATTEND",
        "Experienced managers (at least 10 years of working experience and 4 years in a management role) who:\naspire a more senior management role \nare looking to understand key linkages across disciplines\nseek to maximize their leadership potential\nwant to develop their strategic leadership capabilities",
        "PRACTICAL INFO\n\nTo apply for this programme, you need to complete four steps:\n\n1. Check your eligibility: Check if you meet the admissions criteria for the programme you want to apply for.\n\n2. Submit your application: Fill out the application form and upload it together with your cv or LinkedIn profile.\n\n3. Take part in an interview: When we receive your application, we’ll get in touch to set up an interview. This will take about an hour and will cover:\n\nYour professional experience and current challenges\nYour career ambitions\nWhy you want to take the programme\nWhich electives are right for you (if the programme includes electives)\n\n4. Confirm your registration: If you pass the interview, we’ll send you a registration form. You’ll have two weeks to complete and submit the form to confirm your programme place.",
        "PRACTICAL INFO\n\nTo apply for this programme, you need to complete four steps:\n\n1. Check your eligibility: Check if you meet the admissions criteria for the programme you want to apply for.\n\n2. Submit your application: Fill out the application form and upload it together with your cv or LinkedIn profile.\n\n3. Take part in an interview: When we receive your application, we’ll get in touch to set up an interview. This will take about an hour and will cover:\n\nYour professional experience and current challenges\nYour career ambitions\nWhy you want to take the programme\nWhich electives are right for you (if the programme includes electives)\n\n4. Confirm your registration: If you pass the interview, we’ll send you a registration form. You’ll have two weeks to complete and submit the form to confirm your programme place.",
        "PRACTICAL INFO",
        "To apply for this programme, you need to complete four steps:\n\n1. Check your eligibility: Check if you meet the admissions criteria for the programme you want to apply for.\n\n2. Submit your application: Fill out the application form and upload it together with your cv or LinkedIn profile.\n\n3. Take part in an interview: When we receive your application, we’ll get in touch to set up an interview. This will take about an hour and will cover:\n\nYour professional experience and current challenges\nYour career ambitions\nWhy you want to take the programme\nWhich electives are right for you (if the programme includes electives)\n\n4. Confirm your registration: If you pass the interview, we’ll send you a registration form. You’ll have two weeks to complete and submit the form to confirm your programme place.",
        "FEES AND FINANCING\n\nBoost your impact – and your budget\nDid you know you may be eligible for:\n\nGroup discount: Register three participants from the same company at the same time and get 15% off\nKMO-portefeuille: Flemish SMEs can apply for funding to cover training costs.\nAlumni discount: Vlerick alumni receive 10% off as a thank you for their loyalty to the Vlerick Business School\nVlaams opleidingsverlof: As a participant of this programme, you are entitled to time off from work, and your employer gets a lump sum to cover costs.\n\nCheck all our benefits and make the most of your investment.",
        "FEES AND FINANCING\n\nBoost your impact – and your budget\nDid you know you may be eligible for:\n\nGroup discount: Register three participants from the same company at the same time and get 15% off\nKMO-portefeuille: Flemish SMEs can apply for funding to cover training costs.\nAlumni discount: Vlerick alumni receive 10% off as a thank you for their loyalty to the Vlerick Business School\nVlaams opleidingsverlof: As a participant of this programme, you are entitled to time off from work, and your employer gets a lump sum to cover costs.\n\nCheck all our benefits and make the most of your investment.",
        "FEES AND FINANCING",
        "Boost your impact – and your budget\nDid you know you may be eligible for:\n\nGroup discount: Register three participants from the same company at the same time and get 15% off\nKMO-portefeuille: Flemish SMEs can apply for funding to cover training costs.\nAlumni discount: Vlerick alumni receive 10% off as a thank you for their loyalty to the Vlerick Business School\nVlaams opleidingsverlof: As a participant of this programme, you are entitled to time off from work, and your employer gets a lump sum to cover costs.\n\nCheck all our benefits and make the most of your investment.",
        "FACULTY\nKurt Verweire\n\nProfessor of Strategy\n\nKurt Verweire is a specialist in helping companies to develop and implement winning business strategies. \n\nSteve Muylle\n\nProfessor of Digital Strategy and Marketing\n\nSteve Muylle creates business impact with actionable insight about digital technology.\n\nWouter De Maeseneire\n\nProfessor of Corporate Finance\n\nWouter De Maeseneire is passionate about explaining financial management principles by linking finance to business models and strategies.\n\nKatleen De Stobbeleir\n\nProfessor of Leadership\n\nKatleen De Stobbeleir is inspired by leaders who stand up and speak – and she is passionate about those who have the courage to sit and listen.\n\nKoen Tackx\n\nProfessor of Marketing\n\nKoen Tackx creates sustainable value for customers, shareholders and society with effective pricing, innovation and product management.\n\nCarine Peeters\n\nProfessor of Strategy\n\nCarine Peeters is a firm believer in boosting company performance through people.\n\nBram Doolaege\n\nFounding Partner at Streetwize\n\nBram Doolaege combines teaching leadership and change with social entrepreneurship.\n\nFrank Caron\n\nGeneral Director at Management Today International\n\nFrank Caron is passionate about building real business understanding amongst business professionals.",
        "FACULTY\nKurt Verweire\n\nProfessor of Strategy\n\nKurt Verweire is a specialist in helping companies to develop and implement winning business strategies. \n\nSteve Muylle\n\nProfessor of Digital Strategy and Marketing\n\nSteve Muylle creates business impact with actionable insight about digital technology.\n\nWouter De Maeseneire\n\nProfessor of Corporate Finance\n\nWouter De Maeseneire is passionate about explaining financial management principles by linking finance to business models and strategies.\n\nKatleen De Stobbeleir\n\nProfessor of Leadership\n\nKatleen De Stobbeleir is inspired by leaders who stand up and speak – and she is passionate about those who have the courage to sit and listen.\n\nKoen Tackx\n\nProfessor of Marketing\n\nKoen Tackx creates sustainable value for customers, shareholders and society with effective pricing, innovation and product management.\n\nCarine Peeters\n\nProfessor of Strategy\n\nCarine Peeters is a firm believer in boosting company performance through people.\n\nBram Doolaege\n\nFounding Partner at Streetwize\n\nBram Doolaege combines teaching leadership and change with social entrepreneurship.\n\nFrank Caron\n\nGeneral Director at Management Today International\n\nFrank Caron is passionate about building real business understanding amongst business professionals.",
        "Kurt Verweire\n\nProfessor of Strategy\n\nKurt Verweire is a specialist in helping companies to develop and implement winning business strategies. \n\nSteve Muylle\n\nProfessor of Digital Strategy and Marketing\n\nSteve Muylle creates business impact with actionable insight about digital technology.\n\nWouter De Maeseneire\n\nProfessor of Corporate Finance\n\nWouter De Maeseneire is passionate about explaining financial management principles by linking finance to business models and strategies.\n\nKatleen De Stobbeleir\n\nProfessor of Leadership\n\nKatleen De Stobbeleir is inspired by leaders who stand up and speak – and she is passionate about those who have the courage to sit and listen.\n\nKoen Tackx\n\nProfessor of Marketing\n\nKoen Tackx creates sustainable value for customers, shareholders and society with effective pricing, innovation and product management.\n\nCarine Peeters\n\nProfessor of Strategy\n\nCarine Peeters is a firm believer in boosting company performance through people.\n\nBram Doolaege\n\nFounding Partner at Streetwize\n\nBram Doolaege combines teaching leadership and change with social entrepreneurship.\n\nFrank Caron\n\nGeneral Director at Management Today International\n\nFrank Caron is passionate about building real business understanding amongst business professionals."
    ],
    "testimonials": [],
    "contact": {},
    "full_text": "#1\n\nin Open Executive Education in Belgium and #25 worldwide\n\n3,509\n\nAlumni\n\n4.6/5\n\nfor Learning Impact\n\nOver the course of one year, this programme prepares experienced managers to become more effective and confident business leaders in their organisations.\n\nIt’s a unique opportunity to sharpen your leadership skills, develop a holistic approach to management and deepen your strategic insights.\n\n<\nDetailed programmeWhy this programmeWho should attendPractical infoFees and financingFaculty\nBROCHURE\nAPPLY\nDETAILED PROGRAMME\n\nThe programme will give you insights, tools and frameworks that will empower you to become a more effective and knowledgeable business leader. Throughout the programme, you can immediately apply your learnings in an in-company project - creating immediate value for you and your organisation.  \n\nYou can tailor your learning trajectory by selecting one or more electives (maximum 7 days): either you opt to dive deep into a topic from the core programme or you choose a new one. We gladly assist you in making the right choice.  \n\nWinning with strategy\n\nLearn strategic concepts and how to apply them\nDevelop your strategic thinking and reflect on your organisation’s strategic choices\nDiscover how to respond to competitive marketplaces with strategic innovation\n\n(Self-)leadership \n\nExplore the dynamics of leadership, teamwork and culture – and reflect on your role in building a high-performance team \nDiscover your leadership style through a 360° feedback tool , and create a personal development plan \nLearn how to use your full potential\n\nBusiness mastery\n\nLearn in depth about finance, digital innovation and change management\nDiscover the potential of cross-functional thinking – and how to increase your impact on your organisation \nPut your knowledge and team spirit into action during a business simulation  \n\nElectives\n\nPersonalise your learning journey by selecting up to seven days from our short-term programmes : either dive into a new topic or deepen (one of) the topics of the core programme. Depending on the topic(s) you choose, you can do your electives before, during or after the core programme. You have two years to complete your programme.\n\nIn-company project \n\nApply your new learnings to an in-company project – responding to a business or strategic challenge for your own organisation.\n\nApply your learning to a project from your own organisation\nUse your fellow participants and our expert faculty as a sounding board\nCreate ROI for your organisation\nUPCOMING EDITIONS\nFINANCING YOUR PROGRAMME\nStarts 19 May 2026\n21 days\nBrussels, Ghent, Leuven\n€20,195 (excl. 21% VAT)\nDutch\nSCHEDULE\nAPPLY\nStarts 28 October 2026\n18 days\nBrussels, Ghent, Leuven\n€17,995 (excl. 21% VAT)\nEnglish\nSCHEDULE\nAPPLY\nWHY THIS PROGRAMME\nMake a bigger impact in your organisation \nStrengthen your leadership capabilities and business acumen \nLearn to align cross-functional management domains \nAfter graduating from this programme, you are entitled to join our alumni network. Visit the Vlerick Alumni website for more information\nWHO SHOULD ATTEND\nExperienced managers (at least 10 years of working experience and 4 years in a management role) who:\naspire a more senior management role \nare looking to understand key linkages across disciplines\nseek to maximize their leadership potential\nwant to develop their strategic leadership capabilities\nPRACTICAL INFO\n\nTo apply for this programme, you need to complete four steps:\n\n1. Check your eligibility: Check if you meet the admissions criteria for the programme you want to apply for.\n\n2. Submit your application: Fill out the application form and upload it together with your cv or LinkedIn profile.\n\n3. Take part in an interview: When we receive your application, we’ll get in touch to set up an interview. This will take about an hour and will cover:\n\nYour professional experience and current challenges\nYour career ambitions\nWhy you want to take the programme\nWhich electives are right for you (if the programme includes electives)\n\n4. Confirm your registration: If you pass the interview, we’ll send you a registration form. You’ll have two weeks to complete and submit the form to confirm your programme place.\n\nFEES AND FINANCING\n\nBoost your impact – and your budget\nDid you know you may be eligible for:\n\nGroup discount: Register three participants from the same company at the same time and get 15% off\nKMO-portefeuille: Flemish SMEs can apply for funding to cover training costs.\nAlumni discount: Vlerick alumni receive 10% off as a thank you for their loyalty to the Vlerick Business School\nVlaams opleidingsverlof: As a participant of this programme, you are entitled to time off from work, and your employer gets a lump sum to cover costs.\n\nCheck all our benefits and make the most of your investment.\n\nSUCCESS STORIES\nCINDY WILLEMS\n\nLeading Lady at Fierce Management\n\nVlerick’s Executive Development Programme provided the academic foundation I needed to advance my career. The inspiring professors and practical insights transformed my approach to business. Within 10 months, the investment paid off. It was a life-changing experience, and I’d return in a heartbeat for an MBA!\n\nTINNEKE DENAYER\n\nRare Blood Disorder Leader at Sanofi Genzyme\n\nEvery module delivered new business insights and enhanced motivation to make things happen. Our group was diverse, with people from different sectors of industry and government, as well as entrepreneurs. A dynamic and tight group of great people − and even now we are still in contact. This programme was a building block for the rest of my career. \n\nFACULTY\nKurt Verweire\n\nProfessor of Strategy\n\nKurt Verweire is a specialist in helping companies to develop and implement winning business strategies. \n\nSteve Muylle\n\nProfessor of Digital Strategy and Marketing\n\nSteve Muylle creates business impact with actionable insight about digital technology.\n\nWouter De Maeseneire\n\nProfessor of Corporate Finance\n\nWouter De Maeseneire is passionate about explaining financial management principles by linking finance to business models and strategies.\n\nKatleen De Stobbeleir\n\nProfessor of Leadership\n\nKatleen De Stobbeleir is inspired by leaders who stand up and speak – and she is passionate about those who have the courage to sit and listen.\n\nKoen Tackx\n\nProfessor of Marketing\n\nKoen Tackx creates sustainable value for customers, shareholders and society with effective pricing, innovation and product management.\n\nCarine Peeters\n\nProfessor of Strategy\n\nCarine Peeters is a firm believer in boosting company performance through people.\n\nBram Doolaege\n\nFounding Partner at Streetwize\n\nBram Doolaege combines teaching leadership and change with social entrepreneurship.\n\nFrank Caron\n\nGeneral Director at Management Today International\n\nFrank Caron is passionate about building real business understanding amongst business professionals.\n\nGET IN TOUCH!\nRian De Bruycker\n\nCustomer Relationship Manager\n\nRIAN.DEBRUYCKER@VLERICK.COM\n+32 9 210 92 99\nBOOK AN APPOINTMENT"
}