{
    "url": "https://www.vlerick.com/en/programmes/programmes-in-general-management/management-for-young-leaders/",
    "title": "MANAGEMENT FOR YOUNG LEADERS",
    "subtitle": "",
    "key_facts": {
        "fee": "€7,445 (excl. 21% VAT)",
        "format": "5 days",
        "location": "Brussels",
        "start_date": "Starts 4 May 2026"
    },
    "description": "You want to move into management – and this programme will give you the strategic approaches, financial skills and self-knowledge to make the leap. Take part to expand your leadership skills and grow into the role you want.",
    "sections": [
        {
            "heading": "MOVE INTO MANAGEMENT",
            "content": "MANAGEMENT FOR YOUNG LEADERS\nMOVE INTO MANAGEMENT"
        },
        {
            "heading": "#1",
            "content": "#1"
        },
        {
            "heading": "261",
            "content": "261"
        },
        {
            "heading": "4.4/5",
            "content": "4.4/5"
        },
        {
            "heading": "DETAILED PROGRAMME",
            "content": "DETAILED PROGRAMME"
        },
        {
            "heading": "UPCOMING EDITIONS",
            "content": "UPCOMING EDITIONS\nFINANCING YOUR PROGRAMME\n4 - 8 May 2026; 9 June 2026; 12 June 2026\n5 days\nBrussels\n€7,445 (excl. 21% VAT)\nEnglish\nSCHEDULE\nREGISTER\n26 - 29 October 2026; 3 December, 8 – 9 December 2026\nGhent\n€7,445 (excl. 21% VAT)\nEnglish\nSCHEDULE\nREGISTER"
        },
        {
            "heading": "WHY THIS PROGRAMME",
            "content": "WHY THIS PROGRAMME"
        },
        {
            "heading": "WHO SHOULD ATTEND",
            "content": "WHO SHOULD ATTEND"
        },
        {
            "heading": "FEES AND FINANCING",
            "content": "FEES AND FINANCING"
        },
        {
            "heading": "SUCCESS STORIES",
            "content": "SUCCESS STORIES\nJOLIEN MORES\n\nTeamleader Interne Projectleiding at Groep Huyzentruyt\n\nThis programme teaches you the main aspects of leadership and gives you insights into financial, strategic and business management in which the human approach is central. Great for networking and thinking out-of-the-box! The full day of coaching allows you to grow as a person and as a better leader.\n\nYANNICK VLIEGEN\n\nHead of Operations at Knapp Benelux\n\nThis programme has inspired me and improved my confidence. It gives you the foundations for making good decisions, and it makes you more confident that your decisions will also be accepted by your company. I can definitely recommend this programme to everyone who has just started to manage a team.\n\n\n\n\nANNELEEN QUIRYNEN\n\nLawyer at Stibbe/SRL\n\nThis programme gave me the intellectual framework (both hard and soft skills) to support me when taking the next step in my career. The 360° leadership report was excellent: it gave me insight into my own leadership style; and with the help of my coach and peers, I have concrete action plans to achieve my goals.\n\nJONAS VERSTRAETE\n\nOperations Manager Fridge at Sitra\n\nThis programme covers the major aspects of management – from strategy to finance, from people management to power and influence. It gave me the chance to expand my network and become a better leader. I’m also finding that participation in the programme opens doors, in my company and beyond. I definitely recommend it!"
        },
        {
            "heading": "JOLIEN MORES",
            "content": "JOLIEN MORES\n\nTeamleader Interne Projectleiding at Groep Huyzentruyt"
        },
        {
            "heading": "YANNICK VLIEGEN",
            "content": "YANNICK VLIEGEN\n\nHead of Operations at Knapp Benelux"
        },
        {
            "heading": "ANNELEEN QUIRYNEN",
            "content": "ANNELEEN QUIRYNEN\n\nLawyer at Stibbe/SRL"
        },
        {
            "heading": "JONAS VERSTRAETE",
            "content": "JONAS VERSTRAETE\n\nOperations Manager Fridge at Sitra"
        },
        {
            "heading": "FACULTY",
            "content": "FACULTY"
        },
        {
            "heading": "Katleen De Stobbeleir",
            "content": "Katleen De Stobbeleir\n\nProfessor of Leadership"
        },
        {
            "heading": "Carine Peeters",
            "content": "Carine Peeters\n\nProfessor of Strategy"
        },
        {
            "heading": "Mathieu Luypaert",
            "content": "Mathieu Luypaert\n\nProfessor of Corporate Finance"
        },
        {
            "heading": "Jean Vanhoegaerden",
            "content": "Jean Vanhoegaerden\n\nAdjunct Professor of Change Management"
        },
        {
            "heading": "Veroniek De Schamphelaere",
            "content": "Veroniek De Schamphelaere\n\nLecturer of Human Resources Management"
        },
        {
            "heading": "GET IN TOUCH!",
            "content": "GET IN TOUCH!\nNatalie Khoo\n\nSenior Product Manager\n\nNATALIE.KHOO@VLERICK.COM\n+32 9 210 92 26\nBOOK AN APPOINTMENT"
        },
        {
            "heading": "Natalie Khoo",
            "content": "Natalie Khoo\n\nSenior Product Manager\n\nNATALIE.KHOO@VLERICK.COM\n+32 9 210 92 26\nBOOK AN APPOINTMENT"
        },
        {
            "heading": "RELATED PROGRAMMES",
            "content": "RELATED PROGRAMMES\nExecutive Development Programme\n\nGeneral Management\n\nProfessional\n\nUpcoming editions:\n\n19 May 2026 - Dutch - Brussels, Ghent, Leuven\n28 Oct 2026 - English - Brussels, Ghent, Leuven\nAdd to comparison\nBROCHURE\nMORE INFO\nAdvanced Management Programme\n\nStrategy / General Management\n\nProfessional\n\nUpcoming editions:\n\n20 Nov 2026 - Dutch - Brussels, Ghent\nAdd to comparison\nBROCHURE\nMORE INFO"
        },
        {
            "heading": "Executive Development Programme",
            "content": "Executive Development Programme\n\nGeneral Management"
        },
        {
            "heading": "Advanced Management Programme",
            "content": "Advanced Management Programme\n\nStrategy / General Management"
        },
        {
            "heading": "RELATED INSIGHTS",
            "content": "RELATED INSIGHTS\nMORE INSIGHTS\nVlerick’s Social Profit Grant: Helping Fiola define its strategic direction\nGENERAL MANAGEMENT\n10 DECEMBER 2025\nREAD INSIGHT\nTake charge of your career: why career self-management matters more than ever\nPEOPLE MANAGEMENT & LEADERSHIP, HUMAN RESOURCE MANAGEMENT, GENERAL MANAGEMENT\n07 MAY 2025\nVERONIEK DE SCHAMPHELAERE\nREAD INSIGHT"
        },
        {
            "heading": "Vlerick’s Social Profit Grant: Helping Fiola define its strategic direction",
            "content": "Vlerick’s Social Profit Grant: Helping Fiola define its strategic direction"
        },
        {
            "heading": "Take charge of your career: why career self-management matters more than ever",
            "content": "Take charge of your career: why career self-management matters more than ever"
        }
    ],
    "foldable_sections": [
        "DETAILED PROGRAMME\n\nModule 1: Developing and implementing a winning strategy \n\nUnderstand how strategy powers business – and know how to make it come to life for your teams  \nDiagnose strategic strengths and weaknesses in your business or unit\nDiscover how to successfully implement strategy\n\nModule 2: Financial fundamentals\n\nUnderstand key financial terminology\nDiscover the cash conversion cycle, know how to assess the need for working capital – and how to optimise it\nRead and interpret annual reports, balance sheets, P&L and cash flow statements\n\nModule 3: Effective interactions and communication\n\nExperience the strengths and pitfalls of your preferred communication and interaction style\nLearn how you can adapt your communication styles to have greater impact on the behaviour of others\n\nModule 4: Making the move – from doing to leading\n\nLead with impact by shifting from execution to team-driven results through effective delegation and by getting people on board with you\nBuild credibility quickly by earning trust from peers, leaders and direct reports\nUnderstand the difference between being a manager and a leader\nNavigate change, complexity and office politics by managing upwards, decoding informal networks and aligning confidently with your organisational culture\n\nDay 5: Feedback report\n\nAssess your leadership behaviour using the 360° feedback tool\nBenefit from expert Vlerick coaching, in small, safe groups",
        "DETAILED PROGRAMME\n\nModule 1: Developing and implementing a winning strategy \n\nUnderstand how strategy powers business – and know how to make it come to life for your teams  \nDiagnose strategic strengths and weaknesses in your business or unit\nDiscover how to successfully implement strategy\n\nModule 2: Financial fundamentals\n\nUnderstand key financial terminology\nDiscover the cash conversion cycle, know how to assess the need for working capital – and how to optimise it\nRead and interpret annual reports, balance sheets, P&L and cash flow statements\n\nModule 3: Effective interactions and communication\n\nExperience the strengths and pitfalls of your preferred communication and interaction style\nLearn how you can adapt your communication styles to have greater impact on the behaviour of others\n\nModule 4: Making the move – from doing to leading\n\nLead with impact by shifting from execution to team-driven results through effective delegation and by getting people on board with you\nBuild credibility quickly by earning trust from peers, leaders and direct reports\nUnderstand the difference between being a manager and a leader\nNavigate change, complexity and office politics by managing upwards, decoding informal networks and aligning confidently with your organisational culture\n\nDay 5: Feedback report\n\nAssess your leadership behaviour using the 360° feedback tool\nBenefit from expert Vlerick coaching, in small, safe groups",
        "DETAILED PROGRAMME",
        "Module 1: Developing and implementing a winning strategy \n\nUnderstand how strategy powers business – and know how to make it come to life for your teams  \nDiagnose strategic strengths and weaknesses in your business or unit\nDiscover how to successfully implement strategy\n\nModule 2: Financial fundamentals\n\nUnderstand key financial terminology\nDiscover the cash conversion cycle, know how to assess the need for working capital – and how to optimise it\nRead and interpret annual reports, balance sheets, P&L and cash flow statements\n\nModule 3: Effective interactions and communication\n\nExperience the strengths and pitfalls of your preferred communication and interaction style\nLearn how you can adapt your communication styles to have greater impact on the behaviour of others\n\nModule 4: Making the move – from doing to leading\n\nLead with impact by shifting from execution to team-driven results through effective delegation and by getting people on board with you\nBuild credibility quickly by earning trust from peers, leaders and direct reports\nUnderstand the difference between being a manager and a leader\nNavigate change, complexity and office politics by managing upwards, decoding informal networks and aligning confidently with your organisational culture\n\nDay 5: Feedback report\n\nAssess your leadership behaviour using the 360° feedback tool\nBenefit from expert Vlerick coaching, in small, safe groups",
        "WHY THIS PROGRAMME\nStrengthen your financial understanding and strategic know-how\nDevelop the confidence and ability to take on your (next) managerial role\nGet feedback and coaching on your leadership approach\nExperience the power of networking with peers who face similar challenges and opportunities",
        "WHY THIS PROGRAMME\nStrengthen your financial understanding and strategic know-how\nDevelop the confidence and ability to take on your (next) managerial role\nGet feedback and coaching on your leadership approach\nExperience the power of networking with peers who face similar challenges and opportunities",
        "WHY THIS PROGRAMME",
        "Strengthen your financial understanding and strategic know-how\nDevelop the confidence and ability to take on your (next) managerial role\nGet feedback and coaching on your leadership approach\nExperience the power of networking with peers who face similar challenges and opportunities",
        "WHO SHOULD ATTEND\nFirst-time managers who want to grasp business knowledge and leadership skills\nProfessionals with the potential and ambition to grow and take the next step in their career\nEmployees who want to make a difference in their organisation.\n\nIn previous editions, we had the pleasure of welcoming participants from companies like:",
        "WHO SHOULD ATTEND\nFirst-time managers who want to grasp business knowledge and leadership skills\nProfessionals with the potential and ambition to grow and take the next step in their career\nEmployees who want to make a difference in their organisation.\n\nIn previous editions, we had the pleasure of welcoming participants from companies like:",
        "WHO SHOULD ATTEND",
        "First-time managers who want to grasp business knowledge and leadership skills\nProfessionals with the potential and ambition to grow and take the next step in their career\nEmployees who want to make a difference in their organisation.\n\nIn previous editions, we had the pleasure of welcoming participants from companies like:",
        "FEES AND FINANCING\n\nBoost your impact – and your budget\nDid you know you may be eligible for:\n\nGroup discount: Register three participants from the same company at the same time and get 15% off\nKMO-portefeuille: Flemish SMEs can apply for funding to cover training costs\nAlumni discount: Vlerick alumni receive 10% off as a thank you for their loyalty to the Vlerick Business School\n\nCheck all our benefits and make the most of your investment.",
        "FEES AND FINANCING\n\nBoost your impact – and your budget\nDid you know you may be eligible for:\n\nGroup discount: Register three participants from the same company at the same time and get 15% off\nKMO-portefeuille: Flemish SMEs can apply for funding to cover training costs\nAlumni discount: Vlerick alumni receive 10% off as a thank you for their loyalty to the Vlerick Business School\n\nCheck all our benefits and make the most of your investment.",
        "FEES AND FINANCING",
        "Boost your impact – and your budget\nDid you know you may be eligible for:\n\nGroup discount: Register three participants from the same company at the same time and get 15% off\nKMO-portefeuille: Flemish SMEs can apply for funding to cover training costs\nAlumni discount: Vlerick alumni receive 10% off as a thank you for their loyalty to the Vlerick Business School\n\nCheck all our benefits and make the most of your investment.",
        "FACULTY\nKatleen De Stobbeleir\n\nProfessor of Leadership\n\nKatleen De Stobbeleir is inspired by leaders who stand up and speak – and she is passionate about those who have the courage to sit and listen.\n\nCarine Peeters\n\nProfessor of Strategy\n\nCarine Peeters is a firm believer in boosting company performance through people.\n\nMathieu Luypaert\n\nProfessor of Corporate Finance\n\nMathieu Luypaert explains how insights into financial figures and decisions can lead to value creation.\n\nJean Vanhoegaerden\n\nAdjunct Professor of Change Management\n\nJean Vanhoegaerden has over 25 years of experience teaching executive education programmes across the world.\n\nVeroniek De Schamphelaere\n\nLecturer of Human Resources Management\n\nVeroniek De Schamphelaere is an HR expert with extensive practical experience, who advises on process and career development",
        "FACULTY\nKatleen De Stobbeleir\n\nProfessor of Leadership\n\nKatleen De Stobbeleir is inspired by leaders who stand up and speak – and she is passionate about those who have the courage to sit and listen.\n\nCarine Peeters\n\nProfessor of Strategy\n\nCarine Peeters is a firm believer in boosting company performance through people.\n\nMathieu Luypaert\n\nProfessor of Corporate Finance\n\nMathieu Luypaert explains how insights into financial figures and decisions can lead to value creation.\n\nJean Vanhoegaerden\n\nAdjunct Professor of Change Management\n\nJean Vanhoegaerden has over 25 years of experience teaching executive education programmes across the world.\n\nVeroniek De Schamphelaere\n\nLecturer of Human Resources Management\n\nVeroniek De Schamphelaere is an HR expert with extensive practical experience, who advises on process and career development",
        "Katleen De Stobbeleir\n\nProfessor of Leadership\n\nKatleen De Stobbeleir is inspired by leaders who stand up and speak – and she is passionate about those who have the courage to sit and listen.\n\nCarine Peeters\n\nProfessor of Strategy\n\nCarine Peeters is a firm believer in boosting company performance through people.\n\nMathieu Luypaert\n\nProfessor of Corporate Finance\n\nMathieu Luypaert explains how insights into financial figures and decisions can lead to value creation.\n\nJean Vanhoegaerden\n\nAdjunct Professor of Change Management\n\nJean Vanhoegaerden has over 25 years of experience teaching executive education programmes across the world.\n\nVeroniek De Schamphelaere\n\nLecturer of Human Resources Management\n\nVeroniek De Schamphelaere is an HR expert with extensive practical experience, who advises on process and career development"
    ],
    "testimonials": [],
    "contact": {},
    "full_text": "#1\n\nin Open Executive Education in Belgium and #25 worldwide\n\n261\n\nformer participants\n\n4.4/5\n\nfor Learning Impact\n\nYou want to move into management – and this programme will give you the strategic approaches, financial skills and self-knowledge to make the leap. Take part to expand your leadership skills and grow into the role you want.\n\n<\nDetailed programmeWhy this programmeWho should attendFees and financingFaculty\nBROCHURE\nREGISTER\nDETAILED PROGRAMME\n\nModule 1: Developing and implementing a winning strategy \n\nUnderstand how strategy powers business – and know how to make it come to life for your teams  \nDiagnose strategic strengths and weaknesses in your business or unit\nDiscover how to successfully implement strategy\n\nModule 2: Financial fundamentals\n\nUnderstand key financial terminology\nDiscover the cash conversion cycle, know how to assess the need for working capital – and how to optimise it\nRead and interpret annual reports, balance sheets, P&L and cash flow statements\n\nModule 3: Effective interactions and communication\n\nExperience the strengths and pitfalls of your preferred communication and interaction style\nLearn how you can adapt your communication styles to have greater impact on the behaviour of others\n\nModule 4: Making the move – from doing to leading\n\nLead with impact by shifting from execution to team-driven results through effective delegation and by getting people on board with you\nBuild credibility quickly by earning trust from peers, leaders and direct reports\nUnderstand the difference between being a manager and a leader\nNavigate change, complexity and office politics by managing upwards, decoding informal networks and aligning confidently with your organisational culture\n\nDay 5: Feedback report\n\nAssess your leadership behaviour using the 360° feedback tool\nBenefit from expert Vlerick coaching, in small, safe groups\nUPCOMING EDITIONS\nFINANCING YOUR PROGRAMME\n4 - 8 May 2026; 9 June 2026; 12 June 2026\n5 days\nBrussels\n€7,445 (excl. 21% VAT)\nEnglish\nSCHEDULE\nREGISTER\n26 - 29 October 2026; 3 December, 8 – 9 December 2026\nGhent\n€7,445 (excl. 21% VAT)\nEnglish\nSCHEDULE\nREGISTER\nWHY THIS PROGRAMME\nStrengthen your financial understanding and strategic know-how\nDevelop the confidence and ability to take on your (next) managerial role\nGet feedback and coaching on your leadership approach\nExperience the power of networking with peers who face similar challenges and opportunities\nWHO SHOULD ATTEND\nFirst-time managers who want to grasp business knowledge and leadership skills\nProfessionals with the potential and ambition to grow and take the next step in their career\nEmployees who want to make a difference in their organisation.\n\nIn previous editions, we had the pleasure of welcoming participants from companies like:\n\nFEES AND FINANCING\n\nBoost your impact – and your budget\nDid you know you may be eligible for:\n\nGroup discount: Register three participants from the same company at the same time and get 15% off\nKMO-portefeuille: Flemish SMEs can apply for funding to cover training costs\nAlumni discount: Vlerick alumni receive 10% off as a thank you for their loyalty to the Vlerick Business School\n\nCheck all our benefits and make the most of your investment.\n\nSUCCESS STORIES\nJOLIEN MORES\n\nTeamleader Interne Projectleiding at Groep Huyzentruyt\n\nThis programme teaches you the main aspects of leadership and gives you insights into financial, strategic and business management in which the human approach is central. Great for networking and thinking out-of-the-box! The full day of coaching allows you to grow as a person and as a better leader.\n\nYANNICK VLIEGEN\n\nHead of Operations at Knapp Benelux\n\nThis programme has inspired me and improved my confidence. It gives you the foundations for making good decisions, and it makes you more confident that your decisions will also be accepted by your company. I can definitely recommend this programme to everyone who has just started to manage a team.\n\n\n\n\nANNELEEN QUIRYNEN\n\nLawyer at Stibbe/SRL\n\nThis programme gave me the intellectual framework (both hard and soft skills) to support me when taking the next step in my career. The 360° leadership report was excellent: it gave me insight into my own leadership style; and with the help of my coach and peers, I have concrete action plans to achieve my goals.\n\nJONAS VERSTRAETE\n\nOperations Manager Fridge at Sitra\n\nThis programme covers the major aspects of management – from strategy to finance, from people management to power and influence. It gave me the chance to expand my network and become a better leader. I’m also finding that participation in the programme opens doors, in my company and beyond. I definitely recommend it!\n\nFACULTY\nKatleen De Stobbeleir\n\nProfessor of Leadership\n\nKatleen De Stobbeleir is inspired by leaders who stand up and speak – and she is passionate about those who have the courage to sit and listen.\n\nCarine Peeters\n\nProfessor of Strategy\n\nCarine Peeters is a firm believer in boosting company performance through people.\n\nMathieu Luypaert\n\nProfessor of Corporate Finance\n\nMathieu Luypaert explains how insights into financial figures and decisions can lead to value creation.\n\nJean Vanhoegaerden\n\nAdjunct Professor of Change Management\n\nJean Vanhoegaerden has over 25 years of experience teaching executive education programmes across the world.\n\nVeroniek De Schamphelaere\n\nLecturer of Human Resources Management\n\nVeroniek De Schamphelaere is an HR expert with extensive practical experience, who advises on process and career development\n\nGET IN TOUCH!\nNatalie Khoo\n\nSenior Product Manager\n\nNATALIE.KHOO@VLERICK.COM\n+32 9 210 92 26\nBOOK AN APPOINTMENT"
}