{
    "url": "https://www.vlerick.com/en/programmes/programmes-in-strategy/strategy-in-uncertain-times/",
    "title": "STRATEGY IN UNCERTAIN TIMES",
    "subtitle": "",
    "key_facts": {
        "fee": "€3,995 (excl. 21% VAT)",
        "format": "3 days",
        "location": "Brussels",
        "start_date": "Starts 28 April 2026"
    },
    "description": "When change is constant, how do you plan for the long term? Today’s professionals need to factor uncertainty into their decision-making and planning. They need a mindset of continuous adaptation. And they need to evolve their organisations to become more flexible.\n\nThis three-day programme explores the impact of uncertainty on decision-making, introduces strategic tools to plan for uncertainty, and addresses how to develop adaptive capabilities and implement flexible strategies.",
    "sections": [
        {
            "heading": "DISCOVER HOW TO TURN UNCERTAINTY TO YOUR ADVANTAGE",
            "content": "STRATEGY IN UNCERTAIN TIMES\nDISCOVER HOW TO TURN UNCERTAINTY TO YOUR ADVANTAGE"
        },
        {
            "heading": "#1",
            "content": "#1"
        },
        {
            "heading": "40",
            "content": "40"
        },
        {
            "heading": "4.0/5",
            "content": "4.0/5"
        },
        {
            "heading": "DETAILED PROGRAMME",
            "content": "DETAILED PROGRAMME"
        },
        {
            "heading": "UPCOMING EDITIONS",
            "content": "UPCOMING EDITIONS\nFINANCING YOUR PROGRAMME\n28-30 April 2026; 15 sept 2026\n3 days\nBrussels\n€3,995 (excl. 21% VAT)\nEnglish\nREGISTER\n12-14 April 2027; 14 Sept 2027\n3 days\nBrussels\n€3,995 (excl. 21% VAT)\nEnglish\nREGISTER"
        },
        {
            "heading": "WHY THIS PROGRAMME",
            "content": "WHY THIS PROGRAMME"
        },
        {
            "heading": "WHO SHOULD ATTEND",
            "content": "WHO SHOULD ATTEND"
        },
        {
            "heading": "FEES AND FINANCING",
            "content": "FEES AND FINANCING"
        },
        {
            "heading": "FACULTY",
            "content": "FACULTY"
        },
        {
            "heading": "Carine Peeters",
            "content": "Carine Peeters\n\nProfessor of Strategy"
        },
        {
            "heading": "Kerstin Fehre",
            "content": "Kerstin Fehre\n\nProfessor of Strategy"
        },
        {
            "heading": "Martin Weiss",
            "content": "Martin Weiss\n\nProfessor of Strategy"
        },
        {
            "heading": "GET IN TOUCH!",
            "content": "GET IN TOUCH!\nYulia Zhuk\n\nSenior Product Manager\n\nYULIA.ZHUK@VLERICK.COM\n+32 2 225 41 35\nBOOK AN APPOINTMENT"
        },
        {
            "heading": "Yulia Zhuk",
            "content": "Yulia Zhuk\n\nSenior Product Manager\n\nYULIA.ZHUK@VLERICK.COM\n+32 2 225 41 35\nBOOK AN APPOINTMENT"
        },
        {
            "heading": "RELATED PROGRAMMES",
            "content": "RELATED PROGRAMMES\nAdvanced Management Programme\n\nStrategy / General Management\n\nProfessional\n\nUpcoming editions:\n\n20 Nov 2026 - Dutch - Brussels, Ghent\nAdd to comparison\nBROCHURE\nMORE INFO\nCreating Value through M&A\n\nStrategy / Accounting & Finance\n\nProfessional\n\nUpcoming editions:\n\n30 Mar 2026 - English - Brussels\n16 Nov 2026 - English - Ghent\nAdd to comparison\nBROCHURE\nMORE INFO"
        },
        {
            "heading": "Advanced Management Programme",
            "content": "Advanced Management Programme\n\nStrategy / General Management"
        },
        {
            "heading": "Creating Value through M&A",
            "content": "Creating Value through M&A\n\nStrategy / Accounting & Finance"
        },
        {
            "heading": "RELATED INSIGHTS",
            "content": "RELATED INSIGHTS\nMORE INSIGHTS\nCross-border mid-market M&A compass report 2024\nA research report for Moore Global Corporate Finance\nSTRATEGY\n02 APRIL 2025\nKERSTIN FEHRE\nWANLIN HU\nREAD INSIGHT\nCan an AI strategise?\nSTRATEGY, DIGITAL TRANSFORMATION AND AI\n21 MARCH 2025\nMARTIN BUTLER\nREAD INSIGHT"
        },
        {
            "heading": "Cross-border mid-market M&A compass report 2024",
            "content": "Cross-border mid-market M&A compass report 2024"
        },
        {
            "heading": "Can an AI strategise?",
            "content": "Can an AI strategise?"
        }
    ],
    "foldable_sections": [
        "DETAILED PROGRAMME\n\nThis is why we’re launching a three-day programme, where international strategy experts will focus on strategy in the face of uncertainty – and share practical tools with you. Throughout this three-day programme and follow-up webinar, you’ll discover how to embrace uncertainty and make it work for your organisation.\n\nModule 1: Understanding uncertainty\n\nUnderstand the challenges and opportunities associated with uncertainty\nDiscover how uncertainty impacts strategy and decision-making\nLearn strategies to deal with different degrees of uncertainty\n\n Module 2: Planning for uncertainty\n\nExplore and experiment with strategy analysis tools including pre-mortem analysis, scenario mapping and war games\nLeverage strategic foresight to identify opportunities and minimise risk\nDiscover how to formulate future-proof strategy\n\nModule 3: Organising for uncertainty\n\nAssess your organisation’s level of adaptability – and explore ways to boost it\nLearn to leverage the power of people in implementing adaptable strategies\nBuild an action plan for your organisation\n\nModule 4: Follow-up webinar\n\nReview your action plan and reflect on implementation challenges\nDefine next steps to turn uncertainty into an advantage",
        "DETAILED PROGRAMME\n\nThis is why we’re launching a three-day programme, where international strategy experts will focus on strategy in the face of uncertainty – and share practical tools with you. Throughout this three-day programme and follow-up webinar, you’ll discover how to embrace uncertainty and make it work for your organisation.\n\nModule 1: Understanding uncertainty\n\nUnderstand the challenges and opportunities associated with uncertainty\nDiscover how uncertainty impacts strategy and decision-making\nLearn strategies to deal with different degrees of uncertainty\n\n Module 2: Planning for uncertainty\n\nExplore and experiment with strategy analysis tools including pre-mortem analysis, scenario mapping and war games\nLeverage strategic foresight to identify opportunities and minimise risk\nDiscover how to formulate future-proof strategy\n\nModule 3: Organising for uncertainty\n\nAssess your organisation’s level of adaptability – and explore ways to boost it\nLearn to leverage the power of people in implementing adaptable strategies\nBuild an action plan for your organisation\n\nModule 4: Follow-up webinar\n\nReview your action plan and reflect on implementation challenges\nDefine next steps to turn uncertainty into an advantage",
        "DETAILED PROGRAMME",
        "This is why we’re launching a three-day programme, where international strategy experts will focus on strategy in the face of uncertainty – and share practical tools with you. Throughout this three-day programme and follow-up webinar, you’ll discover how to embrace uncertainty and make it work for your organisation.\n\nModule 1: Understanding uncertainty\n\nUnderstand the challenges and opportunities associated with uncertainty\nDiscover how uncertainty impacts strategy and decision-making\nLearn strategies to deal with different degrees of uncertainty\n\n Module 2: Planning for uncertainty\n\nExplore and experiment with strategy analysis tools including pre-mortem analysis, scenario mapping and war games\nLeverage strategic foresight to identify opportunities and minimise risk\nDiscover how to formulate future-proof strategy\n\nModule 3: Organising for uncertainty\n\nAssess your organisation’s level of adaptability – and explore ways to boost it\nLearn to leverage the power of people in implementing adaptable strategies\nBuild an action plan for your organisation\n\nModule 4: Follow-up webinar\n\nReview your action plan and reflect on implementation challenges\nDefine next steps to turn uncertainty into an advantage",
        "WHY THIS PROGRAMME\nDiscover an integrated, proactive approach to anticipating, embracing and planning for uncertainty\nBe inspired by international experts, like-minded peers, proven methodologies, experiential activities and real-life cases\nDevelop a strategy toolbox that turns uncertainty into an advantage for your organisation\nGain the confidence to make decisions and take action in uncertain times\nLearn to empower your people to implement adaptive strategies\nDevelop an action plan for yourself and your organisation",
        "WHY THIS PROGRAMME\nDiscover an integrated, proactive approach to anticipating, embracing and planning for uncertainty\nBe inspired by international experts, like-minded peers, proven methodologies, experiential activities and real-life cases\nDevelop a strategy toolbox that turns uncertainty into an advantage for your organisation\nGain the confidence to make decisions and take action in uncertain times\nLearn to empower your people to implement adaptive strategies\nDevelop an action plan for yourself and your organisation",
        "WHY THIS PROGRAMME",
        "Discover an integrated, proactive approach to anticipating, embracing and planning for uncertainty\nBe inspired by international experts, like-minded peers, proven methodologies, experiential activities and real-life cases\nDevelop a strategy toolbox that turns uncertainty into an advantage for your organisation\nGain the confidence to make decisions and take action in uncertain times\nLearn to empower your people to implement adaptive strategies\nDevelop an action plan for yourself and your organisation",
        "WHO SHOULD ATTEND\nMid to senior executives and managers\nManagers responsible for developing forward-thinking strategies and action plans\nManagers who want to change the way strategic decisions are handled – and move towards agile implementation",
        "WHO SHOULD ATTEND\nMid to senior executives and managers\nManagers responsible for developing forward-thinking strategies and action plans\nManagers who want to change the way strategic decisions are handled – and move towards agile implementation",
        "WHO SHOULD ATTEND",
        "Mid to senior executives and managers\nManagers responsible for developing forward-thinking strategies and action plans\nManagers who want to change the way strategic decisions are handled – and move towards agile implementation",
        "FEES AND FINANCING\n\nBoost your impact – and your budget\nDid you know you may be eligible for:\n\nGroup discount: Register three participants from the same company at the same time and get 15% off\nKMO-portefeuille: Flemish SMEs can apply for funding to cover training costs\nAlumni discount: Vlerick alumni receive 10% off as a thank you for their loyalty to the Vlerick Business School\n\nCheck all our benefits and make the most of your investment.",
        "FEES AND FINANCING\n\nBoost your impact – and your budget\nDid you know you may be eligible for:\n\nGroup discount: Register three participants from the same company at the same time and get 15% off\nKMO-portefeuille: Flemish SMEs can apply for funding to cover training costs\nAlumni discount: Vlerick alumni receive 10% off as a thank you for their loyalty to the Vlerick Business School\n\nCheck all our benefits and make the most of your investment.",
        "FEES AND FINANCING",
        "Boost your impact – and your budget\nDid you know you may be eligible for:\n\nGroup discount: Register three participants from the same company at the same time and get 15% off\nKMO-portefeuille: Flemish SMEs can apply for funding to cover training costs\nAlumni discount: Vlerick alumni receive 10% off as a thank you for their loyalty to the Vlerick Business School\n\nCheck all our benefits and make the most of your investment.",
        "FACULTY\nCarine Peeters\n\nProfessor of Strategy\n\nCarine Peeters is a firm believer in boosting company performance through people.\n\nKerstin Fehre\n\nProfessor of Strategy\n\nKerstin Fehre is passionate about strategy and explores the ways organisations make strategic decisions.\n\nMartin Weiss\n\nProfessor of Strategy\n\nMartin Weiss furthers corporate strategy in a world of uncertainty and unpredictability.",
        "FACULTY\nCarine Peeters\n\nProfessor of Strategy\n\nCarine Peeters is a firm believer in boosting company performance through people.\n\nKerstin Fehre\n\nProfessor of Strategy\n\nKerstin Fehre is passionate about strategy and explores the ways organisations make strategic decisions.\n\nMartin Weiss\n\nProfessor of Strategy\n\nMartin Weiss furthers corporate strategy in a world of uncertainty and unpredictability.",
        "Carine Peeters\n\nProfessor of Strategy\n\nCarine Peeters is a firm believer in boosting company performance through people.\n\nKerstin Fehre\n\nProfessor of Strategy\n\nKerstin Fehre is passionate about strategy and explores the ways organisations make strategic decisions.\n\nMartin Weiss\n\nProfessor of Strategy\n\nMartin Weiss furthers corporate strategy in a world of uncertainty and unpredictability."
    ],
    "testimonials": [],
    "contact": {},
    "full_text": "#1\n\nin Open Executive Education in Belgium and #25 worldwide\n\n40\n\nformer participants\n\n4.0/5 \n\nfor Learning Impact\n\nWhen change is constant, how do you plan for the long term? Today’s professionals need to factor uncertainty into their decision-making and planning. They need a mindset of continuous adaptation. And they need to evolve their organisations to become more flexible.\n\nThis three-day programme explores the impact of uncertainty on decision-making, introduces strategic tools to plan for uncertainty, and addresses how to develop adaptive capabilities and implement flexible strategies.\n\n<\nDetailed programmeWhy this programmeWho should attendFees and financingFaculty\nBROCHURE\nREGISTER\nDETAILED PROGRAMME\n\nThis is why we’re launching a three-day programme, where international strategy experts will focus on strategy in the face of uncertainty – and share practical tools with you. Throughout this three-day programme and follow-up webinar, you’ll discover how to embrace uncertainty and make it work for your organisation.\n\nModule 1: Understanding uncertainty\n\nUnderstand the challenges and opportunities associated with uncertainty\nDiscover how uncertainty impacts strategy and decision-making\nLearn strategies to deal with different degrees of uncertainty\n\n Module 2: Planning for uncertainty\n\nExplore and experiment with strategy analysis tools including pre-mortem analysis, scenario mapping and war games\nLeverage strategic foresight to identify opportunities and minimise risk\nDiscover how to formulate future-proof strategy\n\nModule 3: Organising for uncertainty\n\nAssess your organisation’s level of adaptability – and explore ways to boost it\nLearn to leverage the power of people in implementing adaptable strategies\nBuild an action plan for your organisation\n\nModule 4: Follow-up webinar\n\nReview your action plan and reflect on implementation challenges\nDefine next steps to turn uncertainty into an advantage\nUPCOMING EDITIONS\nFINANCING YOUR PROGRAMME\n28-30 April 2026; 15 sept 2026\n3 days\nBrussels\n€3,995 (excl. 21% VAT)\nEnglish\nREGISTER\n12-14 April 2027; 14 Sept 2027\n3 days\nBrussels\n€3,995 (excl. 21% VAT)\nEnglish\nREGISTER\nWHY THIS PROGRAMME\nDiscover an integrated, proactive approach to anticipating, embracing and planning for uncertainty\nBe inspired by international experts, like-minded peers, proven methodologies, experiential activities and real-life cases\nDevelop a strategy toolbox that turns uncertainty into an advantage for your organisation\nGain the confidence to make decisions and take action in uncertain times\nLearn to empower your people to implement adaptive strategies\nDevelop an action plan for yourself and your organisation\n\n\n\nWhy this programme? \n\nProfessor Kerstin Fehre explains how “Strategy in Uncertain Times” equips organisations with strategic tools to transform uncertainty into opportunity, fostering a resilient workforce and agile decision-making to maintain a competitive edge.\n\nWHO SHOULD ATTEND\nMid to senior executives and managers\nManagers responsible for developing forward-thinking strategies and action plans\nManagers who want to change the way strategic decisions are handled – and move towards agile implementation\nFEES AND FINANCING\n\nBoost your impact – and your budget\nDid you know you may be eligible for:\n\nGroup discount: Register three participants from the same company at the same time and get 15% off\nKMO-portefeuille: Flemish SMEs can apply for funding to cover training costs\nAlumni discount: Vlerick alumni receive 10% off as a thank you for their loyalty to the Vlerick Business School\n\nCheck all our benefits and make the most of your investment.\n\nFACULTY\nCarine Peeters\n\nProfessor of Strategy\n\nCarine Peeters is a firm believer in boosting company performance through people.\n\nKerstin Fehre\n\nProfessor of Strategy\n\nKerstin Fehre is passionate about strategy and explores the ways organisations make strategic decisions.\n\nMartin Weiss\n\nProfessor of Strategy\n\nMartin Weiss furthers corporate strategy in a world of uncertainty and unpredictability.\n\nGET IN TOUCH!\nYulia Zhuk\n\nSenior Product Manager\n\nYULIA.ZHUK@VLERICK.COM\n+32 2 225 41 35\nBOOK AN APPOINTMENT"
}